No.     Time           Source                Destination           Protocol Length Info
      1 0.000000000    172.17.0.2            172.17.0.3            TCP      74     42834 → 22 [SYN] Seq=0 Win=64240 Len=0 MSS=1460 SACK_PERM TSval=1202465991 TSecr=0 WS=128

Frame 1: 74 bytes on wire (592 bits), 74 bytes captured (592 bits) on interface docker0, id 0
Ethernet II, Src: 02:42:ac:11:00:02 (02:42:ac:11:00:02), Dst: 02:42:ac:11:00:03 (02:42:ac:11:00:03)
Internet Protocol Version 4, Src: 172.17.0.2, Dst: 172.17.0.3
Transmission Control Protocol, Src Port: 42834, Dst Port: 22, Seq: 0, Len: 0

No.     Time           Source                Destination           Protocol Length Info
      2 0.000019485    172.17.0.3            172.17.0.2            TCP      74     22 → 42834 [SYN, ACK] Seq=0 Ack=1 Win=65160 Len=0 MSS=1460 SACK_PERM TSval=4254753452 TSecr=1202465991 WS=128

Frame 2: 74 bytes on wire (592 bits), 74 bytes captured (592 bits) on interface docker0, id 0
Ethernet II, Src: 02:42:ac:11:00:03 (02:42:ac:11:00:03), Dst: 02:42:ac:11:00:02 (02:42:ac:11:00:02)
Internet Protocol Version 4, Src: 172.17.0.3, Dst: 172.17.0.2
Transmission Control Protocol, Src Port: 22, Dst Port: 42834, Seq: 0, Ack: 1, Len: 0

No.     Time           Source                Destination           Protocol Length Info
      3 0.000034082    172.17.0.2            172.17.0.3            TCP      66     42834 → 22 [ACK] Seq=1 Ack=1 Win=64256 Len=0 TSval=1202465991 TSecr=4254753452

Frame 3: 66 bytes on wire (528 bits), 66 bytes captured (528 bits) on interface docker0, id 0
Ethernet II, Src: 02:42:ac:11:00:02 (02:42:ac:11:00:02), Dst: 02:42:ac:11:00:03 (02:42:ac:11:00:03)
Internet Protocol Version 4, Src: 172.17.0.2, Dst: 172.17.0.3
Transmission Control Protocol, Src Port: 42834, Dst Port: 22, Seq: 1, Ack: 1, Len: 0

No.     Time           Source                Destination           Protocol Length Info
      4 0.000257436    172.17.0.3            172.17.0.2            SSHv2    107    Server: Protocol (SSH-2.0-OpenSSH_9.0p1 Ubuntu-1ubuntu7.3)

Frame 4: 107 bytes on wire (856 bits), 107 bytes captured (856 bits) on interface docker0, id 0
Ethernet II, Src: 02:42:ac:11:00:03 (02:42:ac:11:00:03), Dst: 02:42:ac:11:00:02 (02:42:ac:11:00:02)
Internet Protocol Version 4, Src: 172.17.0.3, Dst: 172.17.0.2
Transmission Control Protocol, Src Port: 22, Dst Port: 42834, Seq: 1, Ack: 1, Len: 41
SSH Protocol

No.     Time           Source                Destination           Protocol Length Info
      5 0.000267842    172.17.0.2            172.17.0.3            TCP      66     42834 → 22 [ACK] Seq=1 Ack=42 Win=64256 Len=0 TSval=1202465991 TSecr=4254753452

Frame 5: 66 bytes on wire (528 bits), 66 bytes captured (528 bits) on interface docker0, id 0
Ethernet II, Src: 02:42:ac:11:00:02 (02:42:ac:11:00:02), Dst: 02:42:ac:11:00:03 (02:42:ac:11:00:03)
Internet Protocol Version 4, Src: 172.17.0.2, Dst: 172.17.0.3
Transmission Control Protocol, Src Port: 42834, Dst Port: 22, Seq: 1, Ack: 42, Len: 0

No.     Time           Source                Destination           Protocol Length Info
      6 0.000274477    172.17.0.2            172.17.0.3            SSHv2    107    Client: Protocol (SSH-2.0-OpenSSH_7.3p1 Ubuntu-1ubuntu0.1)

Frame 6: 107 bytes on wire (856 bits), 107 bytes captured (856 bits) on interface docker0, id 0
Ethernet II, Src: 02:42:ac:11:00:02 (02:42:ac:11:00:02), Dst: 02:42:ac:11:00:03 (02:42:ac:11:00:03)
Internet Protocol Version 4, Src: 172.17.0.2, Dst: 172.17.0.3
Transmission Control Protocol, Src Port: 42834, Dst Port: 22, Seq: 1, Ack: 42, Len: 41
SSH Protocol

No.     Time           Source                Destination           Protocol Length Info
      7 0.000282020    172.17.0.3            172.17.0.2            TCP      66     22 → 42834 [ACK] Seq=42 Ack=42 Win=65280 Len=0 TSval=4254753452 TSecr=1202465991

Frame 7: 66 bytes on wire (528 bits), 66 bytes captured (528 bits) on interface docker0, id 0
Ethernet II, Src: 02:42:ac:11:00:03 (02:42:ac:11:00:03), Dst: 02:42:ac:11:00:02 (02:42:ac:11:00:02)
Internet Protocol Version 4, Src: 172.17.0.3, Dst: 172.17.0.2
Transmission Control Protocol, Src Port: 22, Dst Port: 42834, Seq: 42, Ack: 42, Len: 0

No.     Time           Source                Destination           Protocol Length Info
      8 0.000558733    172.17.0.2            172.17.0.3            SSHv2    1498   Client: Key Exchange Init

Frame 8: 1498 bytes on wire (11984 bits), 1498 bytes captured (11984 bits) on interface docker0, id 0
Ethernet II, Src: 02:42:ac:11:00:02 (02:42:ac:11:00:02), Dst: 02:42:ac:11:00:03 (02:42:ac:11:00:03)
Internet Protocol Version 4, Src: 172.17.0.2, Dst: 172.17.0.3
Transmission Control Protocol, Src Port: 42834, Dst Port: 22, Seq: 42, Ack: 42, Len: 1432
SSH Protocol

No.     Time           Source                Destination           Protocol Length Info
      9 0.000567742    172.17.0.3            172.17.0.2            TCP      66     22 → 42834 [ACK] Seq=42 Ack=1474 Win=64128 Len=0 TSval=4254753453 TSecr=1202465992

Frame 9: 66 bytes on wire (528 bits), 66 bytes captured (528 bits) on interface docker0, id 0
Ethernet II, Src: 02:42:ac:11:00:03 (02:42:ac:11:00:03), Dst: 02:42:ac:11:00:02 (02:42:ac:11:00:02)
Internet Protocol Version 4, Src: 172.17.0.3, Dst: 172.17.0.2
Transmission Control Protocol, Src Port: 22, Dst Port: 42834, Seq: 42, Ack: 1474, Len: 0

No.     Time           Source                Destination           Protocol Length Info
     10 0.001349829    172.17.0.3            172.17.0.2            SSHv2    1146   Server: Key Exchange Init

Frame 10: 1146 bytes on wire (9168 bits), 1146 bytes captured (9168 bits) on interface docker0, id 0
Ethernet II, Src: 02:42:ac:11:00:03 (02:42:ac:11:00:03), Dst: 02:42:ac:11:00:02 (02:42:ac:11:00:02)
Internet Protocol Version 4, Src: 172.17.0.3, Dst: 172.17.0.2
Transmission Control Protocol, Src Port: 22, Dst Port: 42834, Seq: 42, Ack: 1474, Len: 1080
SSH Protocol

No.     Time           Source                Destination           Protocol Length Info
     11 0.002473512    172.17.0.2            172.17.0.3            SSHv2    114    Client: Elliptic Curve Diffie-Hellman Key Exchange Init

Frame 11: 114 bytes on wire (912 bits), 114 bytes captured (912 bits) on interface docker0, id 0
Ethernet II, Src: 02:42:ac:11:00:02 (02:42:ac:11:00:02), Dst: 02:42:ac:11:00:03 (02:42:ac:11:00:03)
Internet Protocol Version 4, Src: 172.17.0.2, Dst: 172.17.0.3
Transmission Control Protocol, Src Port: 42834, Dst Port: 22, Seq: 1474, Ack: 1122, Len: 48
SSH Protocol

No.     Time           Source                Destination           Protocol Length Info
     12 0.004851411    172.17.0.3            172.17.0.2            SSHv2    662    Server: Elliptic Curve Diffie-Hellman Key Exchange Reply, New Keys, Encrypted packet (len=316)

Frame 12: 662 bytes on wire (5296 bits), 662 bytes captured (5296 bits) on interface docker0, id 0
Ethernet II, Src: 02:42:ac:11:00:03 (02:42:ac:11:00:03), Dst: 02:42:ac:11:00:02 (02:42:ac:11:00:02)
Internet Protocol Version 4, Src: 172.17.0.3, Dst: 172.17.0.2
Transmission Control Protocol, Src Port: 22, Dst Port: 42834, Seq: 1122, Ack: 1522, Len: 596
SSH Protocol

No.     Time           Source                Destination           Protocol Length Info
     13 0.006207387    172.17.0.2            172.17.0.3            SSHv2    82     Client: New Keys

Frame 13: 82 bytes on wire (656 bits), 82 bytes captured (656 bits) on interface docker0, id 0
Ethernet II, Src: 02:42:ac:11:00:02 (02:42:ac:11:00:02), Dst: 02:42:ac:11:00:03 (02:42:ac:11:00:03)
Internet Protocol Version 4, Src: 172.17.0.2, Dst: 172.17.0.3
Transmission Control Protocol, Src Port: 42834, Dst Port: 22, Seq: 1522, Ack: 1718, Len: 16
SSH Protocol

No.     Time           Source                Destination           Protocol Length Info
     15 0.046437300    172.17.0.3            172.17.0.2            TCP      66     22 → 42834 [ACK] Seq=1718 Ack=1538 Win=64128 Len=0 TSval=4254753499 TSecr=1202465997

Frame 15: 66 bytes on wire (528 bits), 66 bytes captured (528 bits) on interface docker0, id 0
Ethernet II, Src: 02:42:ac:11:00:03 (02:42:ac:11:00:03), Dst: 02:42:ac:11:00:02 (02:42:ac:11:00:02)
Internet Protocol Version 4, Src: 172.17.0.3, Dst: 172.17.0.2
Transmission Control Protocol, Src Port: 22, Dst Port: 42834, Seq: 1718, Ack: 1538, Len: 0

No.     Time           Source                Destination           Protocol Length Info
     16 0.046459090    172.17.0.2            172.17.0.3            SSHv2    110    Client: Encrypted packet (len=44)

Frame 16: 110 bytes on wire (880 bits), 110 bytes captured (880 bits) on interface docker0, id 0
Ethernet II, Src: 02:42:ac:11:00:02 (02:42:ac:11:00:02), Dst: 02:42:ac:11:00:03 (02:42:ac:11:00:03)
Internet Protocol Version 4, Src: 172.17.0.2, Dst: 172.17.0.3
Transmission Control Protocol, Src Port: 42834, Dst Port: 22, Seq: 1538, Ack: 1718, Len: 44
SSH Protocol

No.     Time           Source                Destination           Protocol Length Info
     17 0.046471871    172.17.0.3            172.17.0.2            TCP      66     22 → 42834 [ACK] Seq=1718 Ack=1582 Win=64128 Len=0 TSval=4254753499 TSecr=1202466038

Frame 17: 66 bytes on wire (528 bits), 66 bytes captured (528 bits) on interface docker0, id 0
Ethernet II, Src: 02:42:ac:11:00:03 (02:42:ac:11:00:03), Dst: 02:42:ac:11:00:02 (02:42:ac:11:00:02)
Internet Protocol Version 4, Src: 172.17.0.3, Dst: 172.17.0.2
Transmission Control Protocol, Src Port: 22, Dst Port: 42834, Seq: 1718, Ack: 1582, Len: 0

No.     Time           Source                Destination           Protocol Length Info
     18 0.046559383    172.17.0.3            172.17.0.2            SSHv2    110    Server: Encrypted packet (len=44)

Frame 18: 110 bytes on wire (880 bits), 110 bytes captured (880 bits) on interface docker0, id 0
Ethernet II, Src: 02:42:ac:11:00:03 (02:42:ac:11:00:03), Dst: 02:42:ac:11:00:02 (02:42:ac:11:00:02)
Internet Protocol Version 4, Src: 172.17.0.3, Dst: 172.17.0.2
Transmission Control Protocol, Src Port: 22, Dst Port: 42834, Seq: 1718, Ack: 1582, Len: 44
SSH Protocol

No.     Time           Source                Destination           Protocol Length Info
     19 0.046631320    172.17.0.2            172.17.0.3            SSHv2    134    Client: Encrypted packet (len=68)

Frame 19: 134 bytes on wire (1072 bits), 134 bytes captured (1072 bits) on interface docker0, id 0
Ethernet II, Src: 02:42:ac:11:00:02 (02:42:ac:11:00:02), Dst: 02:42:ac:11:00:03 (02:42:ac:11:00:03)
Internet Protocol Version 4, Src: 172.17.0.2, Dst: 172.17.0.3
Transmission Control Protocol, Src Port: 42834, Dst Port: 22, Seq: 1582, Ack: 1762, Len: 68
SSH Protocol

No.     Time           Source                Destination           Protocol Length Info
     20 0.055574684    172.17.0.3            172.17.0.2            SSHv2    118    Server: Encrypted packet (len=52)

Frame 20: 118 bytes on wire (944 bits), 118 bytes captured (944 bits) on interface docker0, id 0
Ethernet II, Src: 02:42:ac:11:00:03 (02:42:ac:11:00:03), Dst: 02:42:ac:11:00:02 (02:42:ac:11:00:02)
Internet Protocol Version 4, Src: 172.17.0.3, Dst: 172.17.0.2
Transmission Control Protocol, Src Port: 22, Dst Port: 42834, Seq: 1762, Ack: 1650, Len: 52
SSH Protocol

No.     Time           Source                Destination           Protocol Length Info
     21 0.096423534    172.17.0.2            172.17.0.3            TCP      66     42834 → 22 [ACK] Seq=1650 Ack=1814 Win=64128 Len=0 TSval=1202466088 TSecr=4254753508

Frame 21: 66 bytes on wire (528 bits), 66 bytes captured (528 bits) on interface docker0, id 0
Ethernet II, Src: 02:42:ac:11:00:02 (02:42:ac:11:00:02), Dst: 02:42:ac:11:00:03 (02:42:ac:11:00:03)
Internet Protocol Version 4, Src: 172.17.0.2, Dst: 172.17.0.3
Transmission Control Protocol, Src Port: 42834, Dst Port: 22, Seq: 1650, Ack: 1814, Len: 0

No.     Time           Source                Destination           Protocol Length Info
     25 3.436002368    172.17.0.2            172.17.0.3            SSHv2    214    Client: Encrypted packet (len=148)

Frame 25: 214 bytes on wire (1712 bits), 214 bytes captured (1712 bits) on interface docker0, id 0
Ethernet II, Src: 02:42:ac:11:00:02 (02:42:ac:11:00:02), Dst: 02:42:ac:11:00:03 (02:42:ac:11:00:03)
Internet Protocol Version 4, Src: 172.17.0.2, Dst: 172.17.0.3
Transmission Control Protocol, Src Port: 42834, Dst Port: 22, Seq: 1650, Ack: 1814, Len: 148
SSH Protocol

No.     Time           Source                Destination           Protocol Length Info
     26 3.471619868    172.17.0.3            172.17.0.2            SSHv2    94     Server: Encrypted packet (len=28)

Frame 26: 94 bytes on wire (752 bits), 94 bytes captured (752 bits) on interface docker0, id 0
Ethernet II, Src: 02:42:ac:11:00:03 (02:42:ac:11:00:03), Dst: 02:42:ac:11:00:02 (02:42:ac:11:00:02)
Internet Protocol Version 4, Src: 172.17.0.3, Dst: 172.17.0.2
Transmission Control Protocol, Src Port: 22, Dst Port: 42834, Seq: 1814, Ack: 1798, Len: 28
SSH Protocol

No.     Time           Source                Destination           Protocol Length Info
     27 3.471637398    172.17.0.2            172.17.0.3            TCP      66     42834 → 22 [ACK] Seq=1798 Ack=1842 Win=64128 Len=0 TSval=1202469463 TSecr=4254756924

Frame 27: 66 bytes on wire (528 bits), 66 bytes captured (528 bits) on interface docker0, id 0
Ethernet II, Src: 02:42:ac:11:00:02 (02:42:ac:11:00:02), Dst: 02:42:ac:11:00:03 (02:42:ac:11:00:03)
Internet Protocol Version 4, Src: 172.17.0.2, Dst: 172.17.0.3
Transmission Control Protocol, Src Port: 42834, Dst Port: 22, Seq: 1798, Ack: 1842, Len: 0

No.     Time           Source                Destination           Protocol Length Info
     28 3.471730148    172.17.0.2            172.17.0.3            SSHv2    178    Client: Encrypted packet (len=112)

Frame 28: 178 bytes on wire (1424 bits), 178 bytes captured (1424 bits) on interface docker0, id 0
Ethernet II, Src: 02:42:ac:11:00:02 (02:42:ac:11:00:02), Dst: 02:42:ac:11:00:03 (02:42:ac:11:00:03)
Internet Protocol Version 4, Src: 172.17.0.2, Dst: 172.17.0.3
Transmission Control Protocol, Src Port: 42834, Dst Port: 22, Seq: 1798, Ack: 1842, Len: 112
SSH Protocol

No.     Time           Source                Destination           Protocol Length Info
     29 3.481940021    172.17.0.3            172.17.0.2            SSHv2    694    Server: Encrypted packet (len=628)

Frame 29: 694 bytes on wire (5552 bits), 694 bytes captured (5552 bits) on interface docker0, id 0
Ethernet II, Src: 02:42:ac:11:00:03 (02:42:ac:11:00:03), Dst: 02:42:ac:11:00:02 (02:42:ac:11:00:02)
Internet Protocol Version 4, Src: 172.17.0.3, Dst: 172.17.0.2
Transmission Control Protocol, Src Port: 22, Dst Port: 42834, Seq: 1842, Ack: 1910, Len: 628
SSH Protocol

No.     Time           Source                Destination           Protocol Length Info
     30 3.522429257    172.17.0.2            172.17.0.3            TCP      66     42834 → 22 [ACK] Seq=1910 Ack=2470 Win=64128 Len=0 TSval=1202469514 TSecr=4254756934

Frame 30: 66 bytes on wire (528 bits), 66 bytes captured (528 bits) on interface docker0, id 0
Ethernet II, Src: 02:42:ac:11:00:02 (02:42:ac:11:00:02), Dst: 02:42:ac:11:00:03 (02:42:ac:11:00:03)
Internet Protocol Version 4, Src: 172.17.0.2, Dst: 172.17.0.3
Transmission Control Protocol, Src Port: 42834, Dst Port: 22, Seq: 1910, Ack: 2470, Len: 0

No.     Time           Source                Destination           Protocol Length Info
     31 3.522449162    172.17.0.3            172.17.0.2            SSHv2    110    Server: Encrypted packet (len=44)

Frame 31: 110 bytes on wire (880 bits), 110 bytes captured (880 bits) on interface docker0, id 0
Ethernet II, Src: 02:42:ac:11:00:03 (02:42:ac:11:00:03), Dst: 02:42:ac:11:00:02 (02:42:ac:11:00:02)
Internet Protocol Version 4, Src: 172.17.0.3, Dst: 172.17.0.2
Transmission Control Protocol, Src Port: 22, Dst Port: 42834, Seq: 2470, Ack: 1910, Len: 44
SSH Protocol

No.     Time           Source                Destination           Protocol Length Info
     32 3.522462851    172.17.0.2            172.17.0.3            TCP      66     42834 → 22 [ACK] Seq=1910 Ack=2514 Win=64128 Len=0 TSval=1202469514 TSecr=4254756975

Frame 32: 66 bytes on wire (528 bits), 66 bytes captured (528 bits) on interface docker0, id 0
Ethernet II, Src: 02:42:ac:11:00:02 (02:42:ac:11:00:02), Dst: 02:42:ac:11:00:03 (02:42:ac:11:00:03)
Internet Protocol Version 4, Src: 172.17.0.2, Dst: 172.17.0.3
Transmission Control Protocol, Src Port: 42834, Dst Port: 22, Seq: 1910, Ack: 2514, Len: 0

No.     Time           Source                Destination           Protocol Length Info
     33 3.522566985    172.17.0.2            172.17.0.3            SSHv2    442    Client: Encrypted packet (len=376)

Frame 33: 442 bytes on wire (3536 bits), 442 bytes captured (3536 bits) on interface docker0, id 0
Ethernet II, Src: 02:42:ac:11:00:02 (02:42:ac:11:00:02), Dst: 02:42:ac:11:00:03 (02:42:ac:11:00:03)
Internet Protocol Version 4, Src: 172.17.0.2, Dst: 172.17.0.3
Transmission Control Protocol, Src Port: 42834, Dst Port: 22, Seq: 1910, Ack: 2514, Len: 376
SSH Protocol

No.     Time           Source                Destination           Protocol Length Info
     34 3.523836846    172.17.0.3            172.17.0.2            SSHv2    174    Server: Encrypted packet (len=108)

Frame 34: 174 bytes on wire (1392 bits), 174 bytes captured (1392 bits) on interface docker0, id 0
Ethernet II, Src: 02:42:ac:11:00:03 (02:42:ac:11:00:03), Dst: 02:42:ac:11:00:02 (02:42:ac:11:00:02)
Internet Protocol Version 4, Src: 172.17.0.3, Dst: 172.17.0.2
Transmission Control Protocol, Src Port: 22, Dst Port: 42834, Seq: 2514, Ack: 2286, Len: 108
SSH Protocol

No.     Time           Source                Destination           Protocol Length Info
     35 3.524036942    172.17.0.3            172.17.0.2            SSHv2    566    Server: Encrypted packet (len=500)

Frame 35: 566 bytes on wire (4528 bits), 566 bytes captured (4528 bits) on interface docker0, id 0
Ethernet II, Src: 02:42:ac:11:00:03 (02:42:ac:11:00:03), Dst: 02:42:ac:11:00:02 (02:42:ac:11:00:02)
Internet Protocol Version 4, Src: 172.17.0.3, Dst: 172.17.0.2
Transmission Control Protocol, Src Port: 22, Dst Port: 42834, Seq: 2622, Ack: 2286, Len: 500
SSH Protocol

No.     Time           Source                Destination           Protocol Length Info
     36 3.524059221    172.17.0.2            172.17.0.3            TCP      66     42834 → 22 [ACK] Seq=2286 Ack=3122 Win=64128 Len=0 TSval=1202469515 TSecr=4254756976

Frame 36: 66 bytes on wire (528 bits), 66 bytes captured (528 bits) on interface docker0, id 0
Ethernet II, Src: 02:42:ac:11:00:02 (02:42:ac:11:00:02), Dst: 02:42:ac:11:00:03 (02:42:ac:11:00:03)
Internet Protocol Version 4, Src: 172.17.0.2, Dst: 172.17.0.3
Transmission Control Protocol, Src Port: 42834, Dst Port: 22, Seq: 2286, Ack: 3122, Len: 0

No.     Time           Source                Destination           Protocol Length Info
     37 3.524380423    172.17.0.3            172.17.0.2            SSHv2    414    Server: Encrypted packet (len=348)

Frame 37: 414 bytes on wire (3312 bits), 414 bytes captured (3312 bits) on interface docker0, id 0
Ethernet II, Src: 02:42:ac:11:00:03 (02:42:ac:11:00:03), Dst: 02:42:ac:11:00:02 (02:42:ac:11:00:02)
Internet Protocol Version 4, Src: 172.17.0.3, Dst: 172.17.0.2
Transmission Control Protocol, Src Port: 22, Dst Port: 42834, Seq: 3122, Ack: 2286, Len: 348
SSH Protocol

No.     Time           Source                Destination           Protocol Length Info
     38 3.528535862    172.17.0.3            172.17.0.2            SSHv2    158    Server: Encrypted packet (len=92)

Frame 38: 158 bytes on wire (1264 bits), 158 bytes captured (1264 bits) on interface docker0, id 0
Ethernet II, Src: 02:42:ac:11:00:03 (02:42:ac:11:00:03), Dst: 02:42:ac:11:00:02 (02:42:ac:11:00:02)
Internet Protocol Version 4, Src: 172.17.0.3, Dst: 172.17.0.2
Transmission Control Protocol, Src Port: 22, Dst Port: 42834, Seq: 3470, Ack: 2286, Len: 92
SSH Protocol

No.     Time           Source                Destination           Protocol Length Info
     39 3.528566174    172.17.0.2            172.17.0.3            TCP      66     42834 → 22 [ACK] Seq=2286 Ack=3562 Win=64128 Len=0 TSval=1202469520 TSecr=4254756976

Frame 39: 66 bytes on wire (528 bits), 66 bytes captured (528 bits) on interface docker0, id 0
Ethernet II, Src: 02:42:ac:11:00:02 (02:42:ac:11:00:02), Dst: 02:42:ac:11:00:03 (02:42:ac:11:00:03)
Internet Protocol Version 4, Src: 172.17.0.2, Dst: 172.17.0.3
Transmission Control Protocol, Src Port: 42834, Dst Port: 22, Seq: 2286, Ack: 3562, Len: 0
