No.     Time           Source                Destination           Protocol Length Info
     10 25.465770428   172.17.0.2            172.17.0.3            TCP      74     58480 → 22 [SYN] Seq=0 Win=64240 Len=0 MSS=1460 SACK_PERM TSval=1204209340 TSecr=0 WS=128

Frame 10: 74 bytes on wire (592 bits), 74 bytes captured (592 bits) on interface docker0, id 0
Ethernet II, Src: 02:42:ac:11:00:02 (02:42:ac:11:00:02), Dst: 02:42:ac:11:00:03 (02:42:ac:11:00:03)
Internet Protocol Version 4, Src: 172.17.0.2, Dst: 172.17.0.3
Transmission Control Protocol, Src Port: 58480, Dst Port: 22, Seq: 0, Len: 0

No.     Time           Source                Destination           Protocol Length Info
     11 25.465785094   172.17.0.3            172.17.0.2            TCP      74     22 → 58480 [SYN, ACK] Seq=0 Ack=1 Win=65160 Len=0 MSS=1460 SACK_PERM TSval=4256496801 TSecr=1204209340 WS=128

Frame 11: 74 bytes on wire (592 bits), 74 bytes captured (592 bits) on interface docker0, id 0
Ethernet II, Src: 02:42:ac:11:00:03 (02:42:ac:11:00:03), Dst: 02:42:ac:11:00:02 (02:42:ac:11:00:02)
Internet Protocol Version 4, Src: 172.17.0.3, Dst: 172.17.0.2
Transmission Control Protocol, Src Port: 22, Dst Port: 58480, Seq: 0, Ack: 1, Len: 0

No.     Time           Source                Destination           Protocol Length Info
     12 25.465796897   172.17.0.2            172.17.0.3            TCP      66     58480 → 22 [ACK] Seq=1 Ack=1 Win=64256 Len=0 TSval=1204209340 TSecr=4256496801

Frame 12: 66 bytes on wire (528 bits), 66 bytes captured (528 bits) on interface docker0, id 0
Ethernet II, Src: 02:42:ac:11:00:02 (02:42:ac:11:00:02), Dst: 02:42:ac:11:00:03 (02:42:ac:11:00:03)
Internet Protocol Version 4, Src: 172.17.0.2, Dst: 172.17.0.3
Transmission Control Protocol, Src Port: 58480, Dst Port: 22, Seq: 1, Ack: 1, Len: 0

No.     Time           Source                Destination           Protocol Length Info
     13 25.466027302   172.17.0.3            172.17.0.2            SSHv2    107    Server: Protocol (SSH-2.0-OpenSSH_9.0p1 Ubuntu-1ubuntu7.3)

Frame 13: 107 bytes on wire (856 bits), 107 bytes captured (856 bits) on interface docker0, id 0
Ethernet II, Src: 02:42:ac:11:00:03 (02:42:ac:11:00:03), Dst: 02:42:ac:11:00:02 (02:42:ac:11:00:02)
Internet Protocol Version 4, Src: 172.17.0.3, Dst: 172.17.0.2
Transmission Control Protocol, Src Port: 22, Dst Port: 58480, Seq: 1, Ack: 1, Len: 41
SSH Protocol

No.     Time           Source                Destination           Protocol Length Info
     14 25.466040572   172.17.0.2            172.17.0.3            TCP      66     58480 → 22 [ACK] Seq=1 Ack=42 Win=64256 Len=0 TSval=1204209340 TSecr=4256496801

Frame 14: 66 bytes on wire (528 bits), 66 bytes captured (528 bits) on interface docker0, id 0
Ethernet II, Src: 02:42:ac:11:00:02 (02:42:ac:11:00:02), Dst: 02:42:ac:11:00:03 (02:42:ac:11:00:03)
Internet Protocol Version 4, Src: 172.17.0.2, Dst: 172.17.0.3
Transmission Control Protocol, Src Port: 58480, Dst Port: 22, Seq: 1, Ack: 42, Len: 0

No.     Time           Source                Destination           Protocol Length Info
     15 25.466196247   172.17.0.2            172.17.0.3            SSHv2    107    Client: Protocol (SSH-2.0-OpenSSH_7.7p1 Ubuntu-4ubuntu0.3)

Frame 15: 107 bytes on wire (856 bits), 107 bytes captured (856 bits) on interface docker0, id 0
Ethernet II, Src: 02:42:ac:11:00:02 (02:42:ac:11:00:02), Dst: 02:42:ac:11:00:03 (02:42:ac:11:00:03)
Internet Protocol Version 4, Src: 172.17.0.2, Dst: 172.17.0.3
Transmission Control Protocol, Src Port: 58480, Dst Port: 22, Seq: 1, Ack: 42, Len: 41
SSH Protocol

No.     Time           Source                Destination           Protocol Length Info
     16 25.466204767   172.17.0.3            172.17.0.2            TCP      66     22 → 58480 [ACK] Seq=42 Ack=42 Win=65280 Len=0 TSval=4256496801 TSecr=1204209340

Frame 16: 66 bytes on wire (528 bits), 66 bytes captured (528 bits) on interface docker0, id 0
Ethernet II, Src: 02:42:ac:11:00:03 (02:42:ac:11:00:03), Dst: 02:42:ac:11:00:02 (02:42:ac:11:00:02)
Internet Protocol Version 4, Src: 172.17.0.3, Dst: 172.17.0.2
Transmission Control Protocol, Src Port: 22, Dst Port: 58480, Seq: 42, Ack: 42, Len: 0

No.     Time           Source                Destination           Protocol Length Info
     17 25.466963238   172.17.0.2            172.17.0.3            SSHv2    1426   Client: Key Exchange Init

Frame 17: 1426 bytes on wire (11408 bits), 1426 bytes captured (11408 bits) on interface docker0, id 0
Ethernet II, Src: 02:42:ac:11:00:02 (02:42:ac:11:00:02), Dst: 02:42:ac:11:00:03 (02:42:ac:11:00:03)
Internet Protocol Version 4, Src: 172.17.0.2, Dst: 172.17.0.3
Transmission Control Protocol, Src Port: 58480, Dst Port: 22, Seq: 42, Ack: 42, Len: 1360
SSH Protocol

No.     Time           Source                Destination           Protocol Length Info
     18 25.466970292   172.17.0.3            172.17.0.2            TCP      66     22 → 58480 [ACK] Seq=42 Ack=1402 Win=64128 Len=0 TSval=4256496802 TSecr=1204209341

Frame 18: 66 bytes on wire (528 bits), 66 bytes captured (528 bits) on interface docker0, id 0
Ethernet II, Src: 02:42:ac:11:00:03 (02:42:ac:11:00:03), Dst: 02:42:ac:11:00:02 (02:42:ac:11:00:02)
Internet Protocol Version 4, Src: 172.17.0.3, Dst: 172.17.0.2
Transmission Control Protocol, Src Port: 22, Dst Port: 58480, Seq: 42, Ack: 1402, Len: 0

No.     Time           Source                Destination           Protocol Length Info
     19 25.467460854   172.17.0.3            172.17.0.2            SSHv2    1146   Server: Key Exchange Init

Frame 19: 1146 bytes on wire (9168 bits), 1146 bytes captured (9168 bits) on interface docker0, id 0
Ethernet II, Src: 02:42:ac:11:00:03 (02:42:ac:11:00:03), Dst: 02:42:ac:11:00:02 (02:42:ac:11:00:02)
Internet Protocol Version 4, Src: 172.17.0.3, Dst: 172.17.0.2
Transmission Control Protocol, Src Port: 22, Dst Port: 58480, Seq: 42, Ack: 1402, Len: 1080
SSH Protocol

No.     Time           Source                Destination           Protocol Length Info
     20 25.468565106   172.17.0.2            172.17.0.3            SSHv2    114    Client: Elliptic Curve Diffie-Hellman Key Exchange Init

Frame 20: 114 bytes on wire (912 bits), 114 bytes captured (912 bits) on interface docker0, id 0
Ethernet II, Src: 02:42:ac:11:00:02 (02:42:ac:11:00:02), Dst: 02:42:ac:11:00:03 (02:42:ac:11:00:03)
Internet Protocol Version 4, Src: 172.17.0.2, Dst: 172.17.0.3
Transmission Control Protocol, Src Port: 58480, Dst Port: 22, Seq: 1402, Ack: 1122, Len: 48
SSH Protocol

No.     Time           Source                Destination           Protocol Length Info
     21 25.471040962   172.17.0.3            172.17.0.2            SSHv2    662    Server: Elliptic Curve Diffie-Hellman Key Exchange Reply, New Keys, Encrypted packet (len=316)

Frame 21: 662 bytes on wire (5296 bits), 662 bytes captured (5296 bits) on interface docker0, id 0
Ethernet II, Src: 02:42:ac:11:00:03 (02:42:ac:11:00:03), Dst: 02:42:ac:11:00:02 (02:42:ac:11:00:02)
Internet Protocol Version 4, Src: 172.17.0.3, Dst: 172.17.0.2
Transmission Control Protocol, Src Port: 22, Dst Port: 58480, Seq: 1122, Ack: 1450, Len: 596
SSH Protocol

No.     Time           Source                Destination           Protocol Length Info
     22 25.511652678   172.17.0.2            172.17.0.3            TCP      66     58480 → 22 [ACK] Seq=1450 Ack=1718 Win=64128 Len=0 TSval=1204209386 TSecr=4256496806

Frame 22: 66 bytes on wire (528 bits), 66 bytes captured (528 bits) on interface docker0, id 0
Ethernet II, Src: 02:42:ac:11:00:02 (02:42:ac:11:00:02), Dst: 02:42:ac:11:00:03 (02:42:ac:11:00:03)
Internet Protocol Version 4, Src: 172.17.0.2, Dst: 172.17.0.3
Transmission Control Protocol, Src Port: 58480, Dst Port: 22, Seq: 1450, Ack: 1718, Len: 0

No.     Time           Source                Destination           Protocol Length Info
     23 28.043706860   172.17.0.2            172.17.0.3            SSHv2    82     Client: New Keys

Frame 23: 82 bytes on wire (656 bits), 82 bytes captured (656 bits) on interface docker0, id 0
Ethernet II, Src: 02:42:ac:11:00:02 (02:42:ac:11:00:02), Dst: 02:42:ac:11:00:03 (02:42:ac:11:00:03)
Internet Protocol Version 4, Src: 172.17.0.2, Dst: 172.17.0.3
Transmission Control Protocol, Src Port: 58480, Dst Port: 22, Seq: 1450, Ack: 1718, Len: 16
SSH Protocol

No.     Time           Source                Destination           Protocol Length Info
     24 28.084648786   172.17.0.3            172.17.0.2            TCP      66     22 → 58480 [ACK] Seq=1718 Ack=1466 Win=64128 Len=0 TSval=4256499420 TSecr=1204211918

Frame 24: 66 bytes on wire (528 bits), 66 bytes captured (528 bits) on interface docker0, id 0
Ethernet II, Src: 02:42:ac:11:00:03 (02:42:ac:11:00:03), Dst: 02:42:ac:11:00:02 (02:42:ac:11:00:02)
Internet Protocol Version 4, Src: 172.17.0.3, Dst: 172.17.0.2
Transmission Control Protocol, Src Port: 22, Dst Port: 58480, Seq: 1718, Ack: 1466, Len: 0

No.     Time           Source                Destination           Protocol Length Info
     25 28.084668691   172.17.0.2            172.17.0.3            SSHv2    110    Client: Encrypted packet (len=44)

Frame 25: 110 bytes on wire (880 bits), 110 bytes captured (880 bits) on interface docker0, id 0
Ethernet II, Src: 02:42:ac:11:00:02 (02:42:ac:11:00:02), Dst: 02:42:ac:11:00:03 (02:42:ac:11:00:03)
Internet Protocol Version 4, Src: 172.17.0.2, Dst: 172.17.0.3
Transmission Control Protocol, Src Port: 58480, Dst Port: 22, Seq: 1466, Ack: 1718, Len: 44
SSH Protocol

No.     Time           Source                Destination           Protocol Length Info
     26 28.084679516   172.17.0.3            172.17.0.2            TCP      66     22 → 58480 [ACK] Seq=1718 Ack=1510 Win=64128 Len=0 TSval=4256499420 TSecr=1204211959

Frame 26: 66 bytes on wire (528 bits), 66 bytes captured (528 bits) on interface docker0, id 0
Ethernet II, Src: 02:42:ac:11:00:03 (02:42:ac:11:00:03), Dst: 02:42:ac:11:00:02 (02:42:ac:11:00:02)
Internet Protocol Version 4, Src: 172.17.0.3, Dst: 172.17.0.2
Transmission Control Protocol, Src Port: 22, Dst Port: 58480, Seq: 1718, Ack: 1510, Len: 0

No.     Time           Source                Destination           Protocol Length Info
     27 28.084750055   172.17.0.3            172.17.0.2            SSHv2    110    Server: Encrypted packet (len=44)

Frame 27: 110 bytes on wire (880 bits), 110 bytes captured (880 bits) on interface docker0, id 0
Ethernet II, Src: 02:42:ac:11:00:03 (02:42:ac:11:00:03), Dst: 02:42:ac:11:00:02 (02:42:ac:11:00:02)
Internet Protocol Version 4, Src: 172.17.0.3, Dst: 172.17.0.2
Transmission Control Protocol, Src Port: 22, Dst Port: 58480, Seq: 1718, Ack: 1510, Len: 44
SSH Protocol

No.     Time           Source                Destination           Protocol Length Info
     28 28.084763255   172.17.0.2            172.17.0.3            TCP      66     58480 → 22 [ACK] Seq=1510 Ack=1762 Win=64128 Len=0 TSval=1204211959 TSecr=4256499420

Frame 28: 66 bytes on wire (528 bits), 66 bytes captured (528 bits) on interface docker0, id 0
Ethernet II, Src: 02:42:ac:11:00:02 (02:42:ac:11:00:02), Dst: 02:42:ac:11:00:03 (02:42:ac:11:00:03)
Internet Protocol Version 4, Src: 172.17.0.2, Dst: 172.17.0.3
Transmission Control Protocol, Src Port: 58480, Dst Port: 22, Seq: 1510, Ack: 1762, Len: 0

No.     Time           Source                Destination           Protocol Length Info
     29 28.084804461   172.17.0.2            172.17.0.3            SSHv2    134    Client: Encrypted packet (len=68)

Frame 29: 134 bytes on wire (1072 bits), 134 bytes captured (1072 bits) on interface docker0, id 0
Ethernet II, Src: 02:42:ac:11:00:02 (02:42:ac:11:00:02), Dst: 02:42:ac:11:00:03 (02:42:ac:11:00:03)
Internet Protocol Version 4, Src: 172.17.0.2, Dst: 172.17.0.3
Transmission Control Protocol, Src Port: 58480, Dst Port: 22, Seq: 1510, Ack: 1762, Len: 68
SSH Protocol

No.     Time           Source                Destination           Protocol Length Info
     30 28.093742545   172.17.0.3            172.17.0.2            SSHv2    118    Server: Encrypted packet (len=52)

Frame 30: 118 bytes on wire (944 bits), 118 bytes captured (944 bits) on interface docker0, id 0
Ethernet II, Src: 02:42:ac:11:00:03 (02:42:ac:11:00:03), Dst: 02:42:ac:11:00:02 (02:42:ac:11:00:02)
Internet Protocol Version 4, Src: 172.17.0.3, Dst: 172.17.0.2
Transmission Control Protocol, Src Port: 22, Dst Port: 58480, Seq: 1762, Ack: 1578, Len: 52
SSH Protocol

No.     Time           Source                Destination           Protocol Length Info
     31 28.134648574   172.17.0.2            172.17.0.3            TCP      66     58480 → 22 [ACK] Seq=1578 Ack=1814 Win=64128 Len=0 TSval=1204212009 TSecr=4256499429

Frame 31: 66 bytes on wire (528 bits), 66 bytes captured (528 bits) on interface docker0, id 0
Ethernet II, Src: 02:42:ac:11:00:02 (02:42:ac:11:00:02), Dst: 02:42:ac:11:00:03 (02:42:ac:11:00:03)
Internet Protocol Version 4, Src: 172.17.0.2, Dst: 172.17.0.3
Transmission Control Protocol, Src Port: 58480, Dst Port: 22, Seq: 1578, Ack: 1814, Len: 0

No.     Time           Source                Destination           Protocol Length Info
     35 30.060774062   172.17.0.2            172.17.0.3            SSHv2    214    Client: Encrypted packet (len=148)

Frame 35: 214 bytes on wire (1712 bits), 214 bytes captured (1712 bits) on interface docker0, id 0
Ethernet II, Src: 02:42:ac:11:00:02 (02:42:ac:11:00:02), Dst: 02:42:ac:11:00:03 (02:42:ac:11:00:03)
Internet Protocol Version 4, Src: 172.17.0.2, Dst: 172.17.0.3
Transmission Control Protocol, Src Port: 58480, Dst Port: 22, Seq: 1578, Ack: 1814, Len: 148
SSH Protocol

No.     Time           Source                Destination           Protocol Length Info
     36 30.096347049   172.17.0.3            172.17.0.2            SSHv2    94     Server: Encrypted packet (len=28)

Frame 36: 94 bytes on wire (752 bits), 94 bytes captured (752 bits) on interface docker0, id 0
Ethernet II, Src: 02:42:ac:11:00:03 (02:42:ac:11:00:03), Dst: 02:42:ac:11:00:02 (02:42:ac:11:00:02)
Internet Protocol Version 4, Src: 172.17.0.3, Dst: 172.17.0.2
Transmission Control Protocol, Src Port: 22, Dst Port: 58480, Seq: 1814, Ack: 1726, Len: 28
SSH Protocol

No.     Time           Source                Destination           Protocol Length Info
     37 30.096368421   172.17.0.2            172.17.0.3            TCP      66     58480 → 22 [ACK] Seq=1726 Ack=1842 Win=64128 Len=0 TSval=1204213970 TSecr=4256501431

Frame 37: 66 bytes on wire (528 bits), 66 bytes captured (528 bits) on interface docker0, id 0
Ethernet II, Src: 02:42:ac:11:00:02 (02:42:ac:11:00:02), Dst: 02:42:ac:11:00:03 (02:42:ac:11:00:03)
Internet Protocol Version 4, Src: 172.17.0.2, Dst: 172.17.0.3
Transmission Control Protocol, Src Port: 58480, Dst Port: 22, Seq: 1726, Ack: 1842, Len: 0

No.     Time           Source                Destination           Protocol Length Info
     38 30.096474858   172.17.0.2            172.17.0.3            SSHv2    178    Client: Encrypted packet (len=112)

Frame 38: 178 bytes on wire (1424 bits), 178 bytes captured (1424 bits) on interface docker0, id 0
Ethernet II, Src: 02:42:ac:11:00:02 (02:42:ac:11:00:02), Dst: 02:42:ac:11:00:03 (02:42:ac:11:00:03)
Internet Protocol Version 4, Src: 172.17.0.2, Dst: 172.17.0.3
Transmission Control Protocol, Src Port: 58480, Dst Port: 22, Seq: 1726, Ack: 1842, Len: 112
SSH Protocol

No.     Time           Source                Destination           Protocol Length Info
     39 30.108217120   172.17.0.3            172.17.0.2            SSHv2    694    Server: Encrypted packet (len=628)

Frame 39: 694 bytes on wire (5552 bits), 694 bytes captured (5552 bits) on interface docker0, id 0
Ethernet II, Src: 02:42:ac:11:00:03 (02:42:ac:11:00:03), Dst: 02:42:ac:11:00:02 (02:42:ac:11:00:02)
Internet Protocol Version 4, Src: 172.17.0.3, Dst: 172.17.0.2
Transmission Control Protocol, Src Port: 22, Dst Port: 58480, Seq: 1842, Ack: 1838, Len: 628
SSH Protocol

No.     Time           Source                Destination           Protocol Length Info
     40 30.148652354   172.17.0.2            172.17.0.3            TCP      66     58480 → 22 [ACK] Seq=1838 Ack=2470 Win=64128 Len=0 TSval=1204214023 TSecr=4256501443

Frame 40: 66 bytes on wire (528 bits), 66 bytes captured (528 bits) on interface docker0, id 0
Ethernet II, Src: 02:42:ac:11:00:02 (02:42:ac:11:00:02), Dst: 02:42:ac:11:00:03 (02:42:ac:11:00:03)
Internet Protocol Version 4, Src: 172.17.0.2, Dst: 172.17.0.3
Transmission Control Protocol, Src Port: 58480, Dst Port: 22, Seq: 1838, Ack: 2470, Len: 0

No.     Time           Source                Destination           Protocol Length Info
     41 30.148672189   172.17.0.3            172.17.0.2            SSHv2    110    Server: Encrypted packet (len=44)

Frame 41: 110 bytes on wire (880 bits), 110 bytes captured (880 bits) on interface docker0, id 0
Ethernet II, Src: 02:42:ac:11:00:03 (02:42:ac:11:00:03), Dst: 02:42:ac:11:00:02 (02:42:ac:11:00:02)
Internet Protocol Version 4, Src: 172.17.0.3, Dst: 172.17.0.2
Transmission Control Protocol, Src Port: 22, Dst Port: 58480, Seq: 2470, Ack: 1838, Len: 44
SSH Protocol

No.     Time           Source                Destination           Protocol Length Info
     42 30.148683573   172.17.0.2            172.17.0.3            TCP      66     58480 → 22 [ACK] Seq=1838 Ack=2514 Win=64128 Len=0 TSval=1204214023 TSecr=4256501484

Frame 42: 66 bytes on wire (528 bits), 66 bytes captured (528 bits) on interface docker0, id 0
Ethernet II, Src: 02:42:ac:11:00:02 (02:42:ac:11:00:02), Dst: 02:42:ac:11:00:03 (02:42:ac:11:00:03)
Internet Protocol Version 4, Src: 172.17.0.2, Dst: 172.17.0.3
Transmission Control Protocol, Src Port: 58480, Dst Port: 22, Seq: 1838, Ack: 2514, Len: 0

No.     Time           Source                Destination           Protocol Length Info
     43 30.148774855   172.17.0.2            172.17.0.3            SSHv2    442    Client: Encrypted packet (len=376)

Frame 43: 442 bytes on wire (3536 bits), 442 bytes captured (3536 bits) on interface docker0, id 0
Ethernet II, Src: 02:42:ac:11:00:02 (02:42:ac:11:00:02), Dst: 02:42:ac:11:00:03 (02:42:ac:11:00:03)
Internet Protocol Version 4, Src: 172.17.0.2, Dst: 172.17.0.3
Transmission Control Protocol, Src Port: 58480, Dst Port: 22, Seq: 1838, Ack: 2514, Len: 376
SSH Protocol

No.     Time           Source                Destination           Protocol Length Info
     44 30.150503205   172.17.0.3            172.17.0.2            SSHv2    174    Server: Encrypted packet (len=108)

Frame 44: 174 bytes on wire (1392 bits), 174 bytes captured (1392 bits) on interface docker0, id 0
Ethernet II, Src: 02:42:ac:11:00:03 (02:42:ac:11:00:03), Dst: 02:42:ac:11:00:02 (02:42:ac:11:00:02)
Internet Protocol Version 4, Src: 172.17.0.3, Dst: 172.17.0.2
Transmission Control Protocol, Src Port: 22, Dst Port: 58480, Seq: 2514, Ack: 2214, Len: 108
SSH Protocol

No.     Time           Source                Destination           Protocol Length Info
     45 30.150697153   172.17.0.3            172.17.0.2            SSHv2    566    Server: Encrypted packet (len=500)

Frame 45: 566 bytes on wire (4528 bits), 566 bytes captured (4528 bits) on interface docker0, id 0
Ethernet II, Src: 02:42:ac:11:00:03 (02:42:ac:11:00:03), Dst: 02:42:ac:11:00:02 (02:42:ac:11:00:02)
Internet Protocol Version 4, Src: 172.17.0.3, Dst: 172.17.0.2
Transmission Control Protocol, Src Port: 22, Dst Port: 58480, Seq: 2622, Ack: 2214, Len: 500
SSH Protocol

No.     Time           Source                Destination           Protocol Length Info
     46 30.150725508   172.17.0.2            172.17.0.3            TCP      66     58480 → 22 [ACK] Seq=2214 Ack=3122 Win=64128 Len=0 TSval=1204214025 TSecr=4256501485

Frame 46: 66 bytes on wire (528 bits), 66 bytes captured (528 bits) on interface docker0, id 0
Ethernet II, Src: 02:42:ac:11:00:02 (02:42:ac:11:00:02), Dst: 02:42:ac:11:00:03 (02:42:ac:11:00:03)
Internet Protocol Version 4, Src: 172.17.0.2, Dst: 172.17.0.3
Transmission Control Protocol, Src Port: 58480, Dst Port: 22, Seq: 2214, Ack: 3122, Len: 0

No.     Time           Source                Destination           Protocol Length Info
     47 30.150985735   172.17.0.3            172.17.0.2            SSHv2    414    Server: Encrypted packet (len=348)

Frame 47: 414 bytes on wire (3312 bits), 414 bytes captured (3312 bits) on interface docker0, id 0
Ethernet II, Src: 02:42:ac:11:00:03 (02:42:ac:11:00:03), Dst: 02:42:ac:11:00:02 (02:42:ac:11:00:02)
Internet Protocol Version 4, Src: 172.17.0.3, Dst: 172.17.0.2
Transmission Control Protocol, Src Port: 22, Dst Port: 58480, Seq: 3122, Ack: 2214, Len: 348
SSH Protocol

No.     Time           Source                Destination           Protocol Length Info
     48 30.157855415   172.17.0.3            172.17.0.2            SSHv2    158    Server: Encrypted packet (len=92)

Frame 48: 158 bytes on wire (1264 bits), 158 bytes captured (1264 bits) on interface docker0, id 0
Ethernet II, Src: 02:42:ac:11:00:03 (02:42:ac:11:00:03), Dst: 02:42:ac:11:00:02 (02:42:ac:11:00:02)
Internet Protocol Version 4, Src: 172.17.0.3, Dst: 172.17.0.2
Transmission Control Protocol, Src Port: 22, Dst Port: 58480, Seq: 3470, Ack: 2214, Len: 92
SSH Protocol

No.     Time           Source                Destination           Protocol Length Info
     49 30.157901230   172.17.0.2            172.17.0.3            TCP      66     58480 → 22 [ACK] Seq=2214 Ack=3562 Win=64128 Len=0 TSval=1204214032 TSecr=4256501486

Frame 49: 66 bytes on wire (528 bits), 66 bytes captured (528 bits) on interface docker0, id 0
Ethernet II, Src: 02:42:ac:11:00:02 (02:42:ac:11:00:02), Dst: 02:42:ac:11:00:03 (02:42:ac:11:00:03)
Internet Protocol Version 4, Src: 172.17.0.2, Dst: 172.17.0.3
Transmission Control Protocol, Src Port: 58480, Dst Port: 22, Seq: 2214, Ack: 3562, Len: 0
