No.     Time           Source                Destination           Protocol Length Info
      3 0.000034083    172.17.0.2            172.17.0.3            TCP      74     60664 → 22 [SYN] Seq=0 Win=64240 Len=0 MSS=1460 SACK_PERM TSval=1204348563 TSecr=0 WS=128

Frame 3: 74 bytes on wire (592 bits), 74 bytes captured (592 bits) on interface docker0, id 0
Ethernet II, Src: 02:42:ac:11:00:02 (02:42:ac:11:00:02), Dst: 02:42:ac:11:00:03 (02:42:ac:11:00:03)
Internet Protocol Version 4, Src: 172.17.0.2, Dst: 172.17.0.3
Transmission Control Protocol, Src Port: 60664, Dst Port: 22, Seq: 0, Len: 0

No.     Time           Source                Destination           Protocol Length Info
      4 0.000048749    172.17.0.3            172.17.0.2            TCP      74     22 → 60664 [SYN, ACK] Seq=0 Ack=1 Win=65160 Len=0 MSS=1460 SACK_PERM TSval=4256636024 TSecr=1204348563 WS=128

Frame 4: 74 bytes on wire (592 bits), 74 bytes captured (592 bits) on interface docker0, id 0
Ethernet II, Src: 02:42:ac:11:00:03 (02:42:ac:11:00:03), Dst: 02:42:ac:11:00:02 (02:42:ac:11:00:02)
Internet Protocol Version 4, Src: 172.17.0.3, Dst: 172.17.0.2
Transmission Control Protocol, Src Port: 22, Dst Port: 60664, Seq: 0, Ack: 1, Len: 0

No.     Time           Source                Destination           Protocol Length Info
      5 0.000062508    172.17.0.2            172.17.0.3            TCP      66     60664 → 22 [ACK] Seq=1 Ack=1 Win=64256 Len=0 TSval=1204348563 TSecr=4256636024

Frame 5: 66 bytes on wire (528 bits), 66 bytes captured (528 bits) on interface docker0, id 0
Ethernet II, Src: 02:42:ac:11:00:02 (02:42:ac:11:00:02), Dst: 02:42:ac:11:00:03 (02:42:ac:11:00:03)
Internet Protocol Version 4, Src: 172.17.0.2, Dst: 172.17.0.3
Transmission Control Protocol, Src Port: 60664, Dst Port: 22, Seq: 1, Ack: 1, Len: 0

No.     Time           Source                Destination           Protocol Length Info
      6 0.000337821    172.17.0.3            172.17.0.2            SSHv2    107    Server: Protocol (SSH-2.0-OpenSSH_9.0p1 Ubuntu-1ubuntu7.3)

Frame 6: 107 bytes on wire (856 bits), 107 bytes captured (856 bits) on interface docker0, id 0
Ethernet II, Src: 02:42:ac:11:00:03 (02:42:ac:11:00:03), Dst: 02:42:ac:11:00:02 (02:42:ac:11:00:02)
Internet Protocol Version 4, Src: 172.17.0.3, Dst: 172.17.0.2
Transmission Control Protocol, Src Port: 22, Dst Port: 60664, Seq: 1, Ack: 1, Len: 41
SSH Protocol

No.     Time           Source                Destination           Protocol Length Info
      7 0.000354374    172.17.0.2            172.17.0.3            TCP      66     60664 → 22 [ACK] Seq=1 Ack=42 Win=64256 Len=0 TSval=1204348563 TSecr=4256636024

Frame 7: 66 bytes on wire (528 bits), 66 bytes captured (528 bits) on interface docker0, id 0
Ethernet II, Src: 02:42:ac:11:00:02 (02:42:ac:11:00:02), Dst: 02:42:ac:11:00:03 (02:42:ac:11:00:03)
Internet Protocol Version 4, Src: 172.17.0.2, Dst: 172.17.0.3
Transmission Control Protocol, Src Port: 60664, Dst Port: 22, Seq: 1, Ack: 42, Len: 0

No.     Time           Source                Destination           Protocol Length Info
      8 0.000928327    172.17.0.2            172.17.0.3            SSHv2    107    Client: Protocol (SSH-2.0-OpenSSH_8.3p1 Ubuntu-1ubuntu0.1)

Frame 8: 107 bytes on wire (856 bits), 107 bytes captured (856 bits) on interface docker0, id 0
Ethernet II, Src: 02:42:ac:11:00:02 (02:42:ac:11:00:02), Dst: 02:42:ac:11:00:03 (02:42:ac:11:00:03)
Internet Protocol Version 4, Src: 172.17.0.2, Dst: 172.17.0.3
Transmission Control Protocol, Src Port: 60664, Dst Port: 22, Seq: 1, Ack: 42, Len: 41
SSH Protocol

No.     Time           Source                Destination           Protocol Length Info
      9 0.000938244    172.17.0.3            172.17.0.2            TCP      66     22 → 60664 [ACK] Seq=42 Ack=42 Win=65280 Len=0 TSval=4256636025 TSecr=1204348564

Frame 9: 66 bytes on wire (528 bits), 66 bytes captured (528 bits) on interface docker0, id 0
Ethernet II, Src: 02:42:ac:11:00:03 (02:42:ac:11:00:03), Dst: 02:42:ac:11:00:02 (02:42:ac:11:00:02)
Internet Protocol Version 4, Src: 172.17.0.3, Dst: 172.17.0.2
Transmission Control Protocol, Src Port: 22, Dst Port: 60664, Seq: 42, Ack: 42, Len: 0

No.     Time           Source                Destination           Protocol Length Info
     10 0.001076879    172.17.0.2            172.17.0.3            SSHv2    1578   Client: Key Exchange Init

Frame 10: 1578 bytes on wire (12624 bits), 1578 bytes captured (12624 bits) on interface docker0, id 0
Ethernet II, Src: 02:42:ac:11:00:02 (02:42:ac:11:00:02), Dst: 02:42:ac:11:00:03 (02:42:ac:11:00:03)
Internet Protocol Version 4, Src: 172.17.0.2, Dst: 172.17.0.3
Transmission Control Protocol, Src Port: 60664, Dst Port: 22, Seq: 42, Ack: 42, Len: 1512
SSH Protocol

No.     Time           Source                Destination           Protocol Length Info
     11 0.001085399    172.17.0.3            172.17.0.2            TCP      66     22 → 60664 [ACK] Seq=42 Ack=1554 Win=64128 Len=0 TSval=4256636025 TSecr=1204348564

Frame 11: 66 bytes on wire (528 bits), 66 bytes captured (528 bits) on interface docker0, id 0
Ethernet II, Src: 02:42:ac:11:00:03 (02:42:ac:11:00:03), Dst: 02:42:ac:11:00:02 (02:42:ac:11:00:02)
Internet Protocol Version 4, Src: 172.17.0.3, Dst: 172.17.0.2
Transmission Control Protocol, Src Port: 22, Dst Port: 60664, Seq: 42, Ack: 1554, Len: 0

No.     Time           Source                Destination           Protocol Length Info
     12 0.002153617    172.17.0.3            172.17.0.2            SSHv2    1146   Server: Key Exchange Init

Frame 12: 1146 bytes on wire (9168 bits), 1146 bytes captured (9168 bits) on interface docker0, id 0
Ethernet II, Src: 02:42:ac:11:00:03 (02:42:ac:11:00:03), Dst: 02:42:ac:11:00:02 (02:42:ac:11:00:02)
Internet Protocol Version 4, Src: 172.17.0.3, Dst: 172.17.0.2
Transmission Control Protocol, Src Port: 22, Dst Port: 60664, Seq: 42, Ack: 1554, Len: 1080
SSH Protocol

No.     Time           Source                Destination           Protocol Length Info
     13 0.003236571    172.17.0.2            172.17.0.3            SSHv2    114    Client: Elliptic Curve Diffie-Hellman Key Exchange Init

Frame 13: 114 bytes on wire (912 bits), 114 bytes captured (912 bits) on interface docker0, id 0
Ethernet II, Src: 02:42:ac:11:00:02 (02:42:ac:11:00:02), Dst: 02:42:ac:11:00:03 (02:42:ac:11:00:03)
Internet Protocol Version 4, Src: 172.17.0.2, Dst: 172.17.0.3
Transmission Control Protocol, Src Port: 60664, Dst Port: 22, Seq: 1554, Ack: 1122, Len: 48
SSH Protocol

No.     Time           Source                Destination           Protocol Length Info
     14 0.005735133    172.17.0.3            172.17.0.2            SSHv2    662    Server: Elliptic Curve Diffie-Hellman Key Exchange Reply, New Keys, Encrypted packet (len=316)

Frame 14: 662 bytes on wire (5296 bits), 662 bytes captured (5296 bits) on interface docker0, id 0
Ethernet II, Src: 02:42:ac:11:00:03 (02:42:ac:11:00:03), Dst: 02:42:ac:11:00:02 (02:42:ac:11:00:02)
Internet Protocol Version 4, Src: 172.17.0.3, Dst: 172.17.0.2
Transmission Control Protocol, Src Port: 22, Dst Port: 60664, Seq: 1122, Ack: 1602, Len: 596
SSH Protocol

No.     Time           Source                Destination           Protocol Length Info
     15 0.046723202    172.17.0.2            172.17.0.3            TCP      66     60664 → 22 [ACK] Seq=1602 Ack=1718 Win=64128 Len=0 TSval=1204348610 TSecr=4256636030

Frame 15: 66 bytes on wire (528 bits), 66 bytes captured (528 bits) on interface docker0, id 0
Ethernet II, Src: 02:42:ac:11:00:02 (02:42:ac:11:00:02), Dst: 02:42:ac:11:00:03 (02:42:ac:11:00:03)
Internet Protocol Version 4, Src: 172.17.0.2, Dst: 172.17.0.3
Transmission Control Protocol, Src Port: 60664, Dst Port: 22, Seq: 1602, Ack: 1718, Len: 0

No.     Time           Source                Destination           Protocol Length Info
     16 1.510295403    172.17.0.2            172.17.0.3            SSHv2    82     Client: New Keys

Frame 16: 82 bytes on wire (656 bits), 82 bytes captured (656 bits) on interface docker0, id 0
Ethernet II, Src: 02:42:ac:11:00:02 (02:42:ac:11:00:02), Dst: 02:42:ac:11:00:03 (02:42:ac:11:00:03)
Internet Protocol Version 4, Src: 172.17.0.2, Dst: 172.17.0.3
Transmission Control Protocol, Src Port: 60664, Dst Port: 22, Seq: 1602, Ack: 1718, Len: 16
SSH Protocol

No.     Time           Source                Destination           Protocol Length Info
     17 1.550725584    172.17.0.3            172.17.0.2            TCP      66     22 → 60664 [ACK] Seq=1718 Ack=1618 Win=64128 Len=0 TSval=4256637575 TSecr=1204350073

Frame 17: 66 bytes on wire (528 bits), 66 bytes captured (528 bits) on interface docker0, id 0
Ethernet II, Src: 02:42:ac:11:00:03 (02:42:ac:11:00:03), Dst: 02:42:ac:11:00:02 (02:42:ac:11:00:02)
Internet Protocol Version 4, Src: 172.17.0.3, Dst: 172.17.0.2
Transmission Control Protocol, Src Port: 22, Dst Port: 60664, Seq: 1718, Ack: 1618, Len: 0

No.     Time           Source                Destination           Protocol Length Info
     18 1.550744442    172.17.0.2            172.17.0.3            SSHv2    110    Client: Encrypted packet (len=44)

Frame 18: 110 bytes on wire (880 bits), 110 bytes captured (880 bits) on interface docker0, id 0
Ethernet II, Src: 02:42:ac:11:00:02 (02:42:ac:11:00:02), Dst: 02:42:ac:11:00:03 (02:42:ac:11:00:03)
Internet Protocol Version 4, Src: 172.17.0.2, Dst: 172.17.0.3
Transmission Control Protocol, Src Port: 60664, Dst Port: 22, Seq: 1618, Ack: 1718, Len: 44
SSH Protocol

No.     Time           Source                Destination           Protocol Length Info
     19 1.550758689    172.17.0.3            172.17.0.2            TCP      66     22 → 60664 [ACK] Seq=1718 Ack=1662 Win=64128 Len=0 TSval=4256637575 TSecr=1204350114

Frame 19: 66 bytes on wire (528 bits), 66 bytes captured (528 bits) on interface docker0, id 0
Ethernet II, Src: 02:42:ac:11:00:03 (02:42:ac:11:00:03), Dst: 02:42:ac:11:00:02 (02:42:ac:11:00:02)
Internet Protocol Version 4, Src: 172.17.0.3, Dst: 172.17.0.2
Transmission Control Protocol, Src Port: 22, Dst Port: 60664, Seq: 1718, Ack: 1662, Len: 0

No.     Time           Source                Destination           Protocol Length Info
     20 1.550823502    172.17.0.3            172.17.0.2            SSHv2    110    Server: Encrypted packet (len=44)

Frame 20: 110 bytes on wire (880 bits), 110 bytes captured (880 bits) on interface docker0, id 0
Ethernet II, Src: 02:42:ac:11:00:03 (02:42:ac:11:00:03), Dst: 02:42:ac:11:00:02 (02:42:ac:11:00:02)
Internet Protocol Version 4, Src: 172.17.0.3, Dst: 172.17.0.2
Transmission Control Protocol, Src Port: 22, Dst Port: 60664, Seq: 1718, Ack: 1662, Len: 44
SSH Protocol

No.     Time           Source                Destination           Protocol Length Info
     21 1.550833000    172.17.0.2            172.17.0.3            TCP      66     60664 → 22 [ACK] Seq=1662 Ack=1762 Win=64128 Len=0 TSval=1204350114 TSecr=4256637575

Frame 21: 66 bytes on wire (528 bits), 66 bytes captured (528 bits) on interface docker0, id 0
Ethernet II, Src: 02:42:ac:11:00:02 (02:42:ac:11:00:02), Dst: 02:42:ac:11:00:03 (02:42:ac:11:00:03)
Internet Protocol Version 4, Src: 172.17.0.2, Dst: 172.17.0.3
Transmission Control Protocol, Src Port: 60664, Dst Port: 22, Seq: 1662, Ack: 1762, Len: 0

No.     Time           Source                Destination           Protocol Length Info
     22 1.550879793    172.17.0.2            172.17.0.3            SSHv2    134    Client: Encrypted packet (len=68)

Frame 22: 134 bytes on wire (1072 bits), 134 bytes captured (1072 bits) on interface docker0, id 0
Ethernet II, Src: 02:42:ac:11:00:02 (02:42:ac:11:00:02), Dst: 02:42:ac:11:00:03 (02:42:ac:11:00:03)
Internet Protocol Version 4, Src: 172.17.0.2, Dst: 172.17.0.3
Transmission Control Protocol, Src Port: 60664, Dst Port: 22, Seq: 1662, Ack: 1762, Len: 68
SSH Protocol

No.     Time           Source                Destination           Protocol Length Info
     23 1.559828310    172.17.0.3            172.17.0.2            SSHv2    118    Server: Encrypted packet (len=52)

Frame 23: 118 bytes on wire (944 bits), 118 bytes captured (944 bits) on interface docker0, id 0
Ethernet II, Src: 02:42:ac:11:00:03 (02:42:ac:11:00:03), Dst: 02:42:ac:11:00:02 (02:42:ac:11:00:02)
Internet Protocol Version 4, Src: 172.17.0.3, Dst: 172.17.0.2
Transmission Control Protocol, Src Port: 22, Dst Port: 60664, Seq: 1762, Ack: 1730, Len: 52
SSH Protocol

No.     Time           Source                Destination           Protocol Length Info
     24 1.600728311    172.17.0.2            172.17.0.3            TCP      66     60664 → 22 [ACK] Seq=1730 Ack=1814 Win=64128 Len=0 TSval=1204350164 TSecr=4256637584

Frame 24: 66 bytes on wire (528 bits), 66 bytes captured (528 bits) on interface docker0, id 0
Ethernet II, Src: 02:42:ac:11:00:02 (02:42:ac:11:00:02), Dst: 02:42:ac:11:00:03 (02:42:ac:11:00:03)
Internet Protocol Version 4, Src: 172.17.0.2, Dst: 172.17.0.3
Transmission Control Protocol, Src Port: 60664, Dst Port: 22, Seq: 1730, Ack: 1814, Len: 0

No.     Time           Source                Destination           Protocol Length Info
     25 3.696923477    172.17.0.2            172.17.0.3            SSHv2    214    Client: Encrypted packet (len=148)

Frame 25: 214 bytes on wire (1712 bits), 214 bytes captured (1712 bits) on interface docker0, id 0
Ethernet II, Src: 02:42:ac:11:00:02 (02:42:ac:11:00:02), Dst: 02:42:ac:11:00:03 (02:42:ac:11:00:03)
Internet Protocol Version 4, Src: 172.17.0.2, Dst: 172.17.0.3
Transmission Control Protocol, Src Port: 60664, Dst Port: 22, Seq: 1730, Ack: 1814, Len: 148
SSH Protocol

No.     Time           Source                Destination           Protocol Length Info
     26 3.732525901    172.17.0.3            172.17.0.2            SSHv2    94     Server: Encrypted packet (len=28)

Frame 26: 94 bytes on wire (752 bits), 94 bytes captured (752 bits) on interface docker0, id 0
Ethernet II, Src: 02:42:ac:11:00:03 (02:42:ac:11:00:03), Dst: 02:42:ac:11:00:02 (02:42:ac:11:00:02)
Internet Protocol Version 4, Src: 172.17.0.3, Dst: 172.17.0.2
Transmission Control Protocol, Src Port: 22, Dst Port: 60664, Seq: 1814, Ack: 1878, Len: 28
SSH Protocol

No.     Time           Source                Destination           Protocol Length Info
     27 3.732544478    172.17.0.2            172.17.0.3            TCP      66     60664 → 22 [ACK] Seq=1878 Ack=1842 Win=64128 Len=0 TSval=1204352295 TSecr=4256639756

Frame 27: 66 bytes on wire (528 bits), 66 bytes captured (528 bits) on interface docker0, id 0
Ethernet II, Src: 02:42:ac:11:00:02 (02:42:ac:11:00:02), Dst: 02:42:ac:11:00:03 (02:42:ac:11:00:03)
Internet Protocol Version 4, Src: 172.17.0.2, Dst: 172.17.0.3
Transmission Control Protocol, Src Port: 60664, Dst Port: 22, Seq: 1878, Ack: 1842, Len: 0

No.     Time           Source                Destination           Protocol Length Info
     28 3.732679271    172.17.0.2            172.17.0.3            SSHv2    178    Client: Encrypted packet (len=112)

Frame 28: 178 bytes on wire (1424 bits), 178 bytes captured (1424 bits) on interface docker0, id 0
Ethernet II, Src: 02:42:ac:11:00:02 (02:42:ac:11:00:02), Dst: 02:42:ac:11:00:03 (02:42:ac:11:00:03)
Internet Protocol Version 4, Src: 172.17.0.2, Dst: 172.17.0.3
Transmission Control Protocol, Src Port: 60664, Dst Port: 22, Seq: 1878, Ack: 1842, Len: 112
SSH Protocol

No.     Time           Source                Destination           Protocol Length Info
     29 3.743663583    172.17.0.3            172.17.0.2            SSHv2    694    Server: Encrypted packet (len=628)

Frame 29: 694 bytes on wire (5552 bits), 694 bytes captured (5552 bits) on interface docker0, id 0
Ethernet II, Src: 02:42:ac:11:00:03 (02:42:ac:11:00:03), Dst: 02:42:ac:11:00:02 (02:42:ac:11:00:02)
Internet Protocol Version 4, Src: 172.17.0.3, Dst: 172.17.0.2
Transmission Control Protocol, Src Port: 22, Dst Port: 60664, Seq: 1842, Ack: 1990, Len: 628
SSH Protocol

No.     Time           Source                Destination           Protocol Length Info
     30 3.783726123    172.17.0.2            172.17.0.3            TCP      66     60664 → 22 [ACK] Seq=1990 Ack=2470 Win=64128 Len=0 TSval=1204352347 TSecr=4256639767

Frame 30: 66 bytes on wire (528 bits), 66 bytes captured (528 bits) on interface docker0, id 0
Ethernet II, Src: 02:42:ac:11:00:02 (02:42:ac:11:00:02), Dst: 02:42:ac:11:00:03 (02:42:ac:11:00:03)
Internet Protocol Version 4, Src: 172.17.0.2, Dst: 172.17.0.3
Transmission Control Protocol, Src Port: 60664, Dst Port: 22, Seq: 1990, Ack: 2470, Len: 0

No.     Time           Source                Destination           Protocol Length Info
     31 3.783747424    172.17.0.3            172.17.0.2            SSHv2    110    Server: Encrypted packet (len=44)

Frame 31: 110 bytes on wire (880 bits), 110 bytes captured (880 bits) on interface docker0, id 0
Ethernet II, Src: 02:42:ac:11:00:03 (02:42:ac:11:00:03), Dst: 02:42:ac:11:00:02 (02:42:ac:11:00:02)
Internet Protocol Version 4, Src: 172.17.0.3, Dst: 172.17.0.2
Transmission Control Protocol, Src Port: 22, Dst Port: 60664, Seq: 2470, Ack: 1990, Len: 44
SSH Protocol

No.     Time           Source                Destination           Protocol Length Info
     32 3.783760694    172.17.0.2            172.17.0.3            TCP      66     60664 → 22 [ACK] Seq=1990 Ack=2514 Win=64128 Len=0 TSval=1204352347 TSecr=4256639808

Frame 32: 66 bytes on wire (528 bits), 66 bytes captured (528 bits) on interface docker0, id 0
Ethernet II, Src: 02:42:ac:11:00:02 (02:42:ac:11:00:02), Dst: 02:42:ac:11:00:03 (02:42:ac:11:00:03)
Internet Protocol Version 4, Src: 172.17.0.2, Dst: 172.17.0.3
Transmission Control Protocol, Src Port: 60664, Dst Port: 22, Seq: 1990, Ack: 2514, Len: 0

No.     Time           Source                Destination           Protocol Length Info
     33 3.783851557    172.17.0.2            172.17.0.3            SSHv2    442    Client: Encrypted packet (len=376)

Frame 33: 442 bytes on wire (3536 bits), 442 bytes captured (3536 bits) on interface docker0, id 0
Ethernet II, Src: 02:42:ac:11:00:02 (02:42:ac:11:00:02), Dst: 02:42:ac:11:00:03 (02:42:ac:11:00:03)
Internet Protocol Version 4, Src: 172.17.0.2, Dst: 172.17.0.3
Transmission Control Protocol, Src Port: 60664, Dst Port: 22, Seq: 1990, Ack: 2514, Len: 376
SSH Protocol

No.     Time           Source                Destination           Protocol Length Info
     34 3.785213666    172.17.0.3            172.17.0.2            SSHv2    174    Server: Encrypted packet (len=108)

Frame 34: 174 bytes on wire (1392 bits), 174 bytes captured (1392 bits) on interface docker0, id 0
Ethernet II, Src: 02:42:ac:11:00:03 (02:42:ac:11:00:03), Dst: 02:42:ac:11:00:02 (02:42:ac:11:00:02)
Internet Protocol Version 4, Src: 172.17.0.3, Dst: 172.17.0.2
Transmission Control Protocol, Src Port: 22, Dst Port: 60664, Seq: 2514, Ack: 2366, Len: 108
SSH Protocol

No.     Time           Source                Destination           Protocol Length Info
     35 3.785360751    172.17.0.3            172.17.0.2            SSHv2    566    Server: Encrypted packet (len=500)

Frame 35: 566 bytes on wire (4528 bits), 566 bytes captured (4528 bits) on interface docker0, id 0
Ethernet II, Src: 02:42:ac:11:00:03 (02:42:ac:11:00:03), Dst: 02:42:ac:11:00:02 (02:42:ac:11:00:02)
Internet Protocol Version 4, Src: 172.17.0.3, Dst: 172.17.0.2
Transmission Control Protocol, Src Port: 22, Dst Port: 60664, Seq: 2622, Ack: 2366, Len: 500
SSH Protocol

No.     Time           Source                Destination           Protocol Length Info
     36 3.785389596    172.17.0.2            172.17.0.3            TCP      66     60664 → 22 [ACK] Seq=2366 Ack=3122 Win=64128 Len=0 TSval=1204352348 TSecr=4256639809

Frame 36: 66 bytes on wire (528 bits), 66 bytes captured (528 bits) on interface docker0, id 0
Ethernet II, Src: 02:42:ac:11:00:02 (02:42:ac:11:00:02), Dst: 02:42:ac:11:00:03 (02:42:ac:11:00:03)
Internet Protocol Version 4, Src: 172.17.0.2, Dst: 172.17.0.3
Transmission Control Protocol, Src Port: 60664, Dst Port: 22, Seq: 2366, Ack: 3122, Len: 0

No.     Time           Source                Destination           Protocol Length Info
     37 3.785658414    172.17.0.3            172.17.0.2            SSHv2    414    Server: Encrypted packet (len=348)

Frame 37: 414 bytes on wire (3312 bits), 414 bytes captured (3312 bits) on interface docker0, id 0
Ethernet II, Src: 02:42:ac:11:00:03 (02:42:ac:11:00:03), Dst: 02:42:ac:11:00:02 (02:42:ac:11:00:02)
Internet Protocol Version 4, Src: 172.17.0.3, Dst: 172.17.0.2
Transmission Control Protocol, Src Port: 22, Dst Port: 60664, Seq: 3122, Ack: 2366, Len: 348
SSH Protocol

No.     Time           Source                Destination           Protocol Length Info
     38 3.790292014    172.17.0.3            172.17.0.2            SSHv2    158    Server: Encrypted packet (len=92)

Frame 38: 158 bytes on wire (1264 bits), 158 bytes captured (1264 bits) on interface docker0, id 0
Ethernet II, Src: 02:42:ac:11:00:03 (02:42:ac:11:00:03), Dst: 02:42:ac:11:00:02 (02:42:ac:11:00:02)
Internet Protocol Version 4, Src: 172.17.0.3, Dst: 172.17.0.2
Transmission Control Protocol, Src Port: 22, Dst Port: 60664, Seq: 3470, Ack: 2366, Len: 92
SSH Protocol

No.     Time           Source                Destination           Protocol Length Info
     39 3.790332732    172.17.0.2            172.17.0.3            TCP      66     60664 → 22 [ACK] Seq=2366 Ack=3562 Win=64128 Len=0 TSval=1204352353 TSecr=4256639809

Frame 39: 66 bytes on wire (528 bits), 66 bytes captured (528 bits) on interface docker0, id 0
Ethernet II, Src: 02:42:ac:11:00:02 (02:42:ac:11:00:02), Dst: 02:42:ac:11:00:03 (02:42:ac:11:00:03)
Internet Protocol Version 4, Src: 172.17.0.2, Dst: 172.17.0.3
Transmission Control Protocol, Src Port: 60664, Dst Port: 22, Seq: 2366, Ack: 3562, Len: 0
