No.     Time           Source                Destination           Protocol Length Info
      3 0.000037714    172.17.0.2            172.17.0.3            TCP      74     53502 → 22 [SYN] Seq=0 Win=64240 Len=0 MSS=1460 SACK_PERM TSval=1204576199 TSecr=0 WS=128

Frame 3: 74 bytes on wire (592 bits), 74 bytes captured (592 bits) on interface docker0, id 0
Ethernet II, Src: 02:42:ac:11:00:02 (02:42:ac:11:00:02), Dst: 02:42:ac:11:00:03 (02:42:ac:11:00:03)
Internet Protocol Version 4, Src: 172.17.0.2, Dst: 172.17.0.3
Transmission Control Protocol, Src Port: 53502, Dst Port: 22, Seq: 0, Len: 0

No.     Time           Source                Destination           Protocol Length Info
      4 0.000057200    172.17.0.3            172.17.0.2            TCP      74     22 → 53502 [SYN, ACK] Seq=0 Ack=1 Win=65160 Len=0 MSS=1460 SACK_PERM TSval=4256863660 TSecr=1204576199 WS=128

Frame 4: 74 bytes on wire (592 bits), 74 bytes captured (592 bits) on interface docker0, id 0
Ethernet II, Src: 02:42:ac:11:00:03 (02:42:ac:11:00:03), Dst: 02:42:ac:11:00:02 (02:42:ac:11:00:02)
Internet Protocol Version 4, Src: 172.17.0.3, Dst: 172.17.0.2
Transmission Control Protocol, Src Port: 22, Dst Port: 53502, Seq: 0, Ack: 1, Len: 0

No.     Time           Source                Destination           Protocol Length Info
      5 0.000073333    172.17.0.2            172.17.0.3            TCP      66     53502 → 22 [ACK] Seq=1 Ack=1 Win=64256 Len=0 TSval=1204576199 TSecr=4256863660

Frame 5: 66 bytes on wire (528 bits), 66 bytes captured (528 bits) on interface docker0, id 0
Ethernet II, Src: 02:42:ac:11:00:02 (02:42:ac:11:00:02), Dst: 02:42:ac:11:00:03 (02:42:ac:11:00:03)
Internet Protocol Version 4, Src: 172.17.0.2, Dst: 172.17.0.3
Transmission Control Protocol, Src Port: 53502, Dst Port: 22, Seq: 1, Ack: 1, Len: 0

No.     Time           Source                Destination           Protocol Length Info
      6 0.000294171    172.17.0.3            172.17.0.2            SSHv2    107    Server: Protocol (SSH-2.0-OpenSSH_9.0p1 Ubuntu-1ubuntu7.3)

Frame 6: 107 bytes on wire (856 bits), 107 bytes captured (856 bits) on interface docker0, id 0
Ethernet II, Src: 02:42:ac:11:00:03 (02:42:ac:11:00:03), Dst: 02:42:ac:11:00:02 (02:42:ac:11:00:02)
Internet Protocol Version 4, Src: 172.17.0.3, Dst: 172.17.0.2
Transmission Control Protocol, Src Port: 22, Dst Port: 53502, Seq: 1, Ack: 1, Len: 41
SSH Protocol

No.     Time           Source                Destination           Protocol Length Info
      7 0.000308349    172.17.0.2            172.17.0.3            TCP      66     53502 → 22 [ACK] Seq=1 Ack=42 Win=64256 Len=0 TSval=1204576199 TSecr=4256863660

Frame 7: 66 bytes on wire (528 bits), 66 bytes captured (528 bits) on interface docker0, id 0
Ethernet II, Src: 02:42:ac:11:00:02 (02:42:ac:11:00:02), Dst: 02:42:ac:11:00:03 (02:42:ac:11:00:03)
Internet Protocol Version 4, Src: 172.17.0.2, Dst: 172.17.0.3
Transmission Control Protocol, Src Port: 53502, Dst Port: 22, Seq: 1, Ack: 42, Len: 0

No.     Time           Source                Destination           Protocol Length Info
      8 0.000370857    172.17.0.2            172.17.0.3            SSHv2    107    Client: Protocol (SSH-2.0-OpenSSH_9.0p1 Ubuntu-1ubuntu7.3)

Frame 8: 107 bytes on wire (856 bits), 107 bytes captured (856 bits) on interface docker0, id 0
Ethernet II, Src: 02:42:ac:11:00:02 (02:42:ac:11:00:02), Dst: 02:42:ac:11:00:03 (02:42:ac:11:00:03)
Internet Protocol Version 4, Src: 172.17.0.2, Dst: 172.17.0.3
Transmission Control Protocol, Src Port: 53502, Dst Port: 22, Seq: 1, Ack: 42, Len: 41
SSH Protocol

No.     Time           Source                Destination           Protocol Length Info
      9 0.000380355    172.17.0.3            172.17.0.2            TCP      66     22 → 53502 [ACK] Seq=42 Ack=42 Win=65280 Len=0 TSval=4256863660 TSecr=1204576199

Frame 9: 66 bytes on wire (528 bits), 66 bytes captured (528 bits) on interface docker0, id 0
Ethernet II, Src: 02:42:ac:11:00:03 (02:42:ac:11:00:03), Dst: 02:42:ac:11:00:02 (02:42:ac:11:00:02)
Internet Protocol Version 4, Src: 172.17.0.3, Dst: 172.17.0.2
Transmission Control Protocol, Src Port: 22, Dst Port: 53502, Seq: 42, Ack: 42, Len: 0

No.     Time           Source                Destination           Protocol Length Info
     10 0.000909263    172.17.0.2            172.17.0.3            SSHv2    1570   Client: Key Exchange Init

Frame 10: 1570 bytes on wire (12560 bits), 1570 bytes captured (12560 bits) on interface docker0, id 0
Ethernet II, Src: 02:42:ac:11:00:02 (02:42:ac:11:00:02), Dst: 02:42:ac:11:00:03 (02:42:ac:11:00:03)
Internet Protocol Version 4, Src: 172.17.0.2, Dst: 172.17.0.3
Transmission Control Protocol, Src Port: 53502, Dst Port: 22, Seq: 42, Ack: 42, Len: 1504
SSH Protocol

No.     Time           Source                Destination           Protocol Length Info
     11 0.000917294    172.17.0.3            172.17.0.2            TCP      66     22 → 53502 [ACK] Seq=42 Ack=1546 Win=64128 Len=0 TSval=4256863661 TSecr=1204576200

Frame 11: 66 bytes on wire (528 bits), 66 bytes captured (528 bits) on interface docker0, id 0
Ethernet II, Src: 02:42:ac:11:00:03 (02:42:ac:11:00:03), Dst: 02:42:ac:11:00:02 (02:42:ac:11:00:02)
Internet Protocol Version 4, Src: 172.17.0.3, Dst: 172.17.0.2
Transmission Control Protocol, Src Port: 22, Dst Port: 53502, Seq: 42, Ack: 1546, Len: 0

No.     Time           Source                Destination           Protocol Length Info
     12 0.001489713    172.17.0.3            172.17.0.2            SSHv2    1146   Server: Key Exchange Init

Frame 12: 1146 bytes on wire (9168 bits), 1146 bytes captured (9168 bits) on interface docker0, id 0
Ethernet II, Src: 02:42:ac:11:00:03 (02:42:ac:11:00:03), Dst: 02:42:ac:11:00:02 (02:42:ac:11:00:02)
Internet Protocol Version 4, Src: 172.17.0.3, Dst: 172.17.0.2
Transmission Control Protocol, Src Port: 22, Dst Port: 53502, Seq: 42, Ack: 1546, Len: 1080
SSH Protocol

No.     Time           Source                Destination           Protocol Length Info
     13 0.042528068    172.17.0.2            172.17.0.3            TCP      66     53502 → 22 [ACK] Seq=1546 Ack=1122 Win=64128 Len=0 TSval=1204576242 TSecr=4256863661

Frame 13: 66 bytes on wire (528 bits), 66 bytes captured (528 bits) on interface docker0, id 0
Ethernet II, Src: 02:42:ac:11:00:02 (02:42:ac:11:00:02), Dst: 02:42:ac:11:00:03 (02:42:ac:11:00:03)
Internet Protocol Version 4, Src: 172.17.0.2, Dst: 172.17.0.3
Transmission Control Protocol, Src Port: 53502, Dst Port: 22, Seq: 1546, Ack: 1122, Len: 0

No.     Time           Source                Destination           Protocol Length Info
     14 0.042769299    172.17.0.2            172.17.0.3            SSHv2    1274   Client: Diffie-Hellman Key Exchange Init

Frame 14: 1274 bytes on wire (10192 bits), 1274 bytes captured (10192 bits) on interface docker0, id 0
Ethernet II, Src: 02:42:ac:11:00:02 (02:42:ac:11:00:02), Dst: 02:42:ac:11:00:03 (02:42:ac:11:00:03)
Internet Protocol Version 4, Src: 172.17.0.2, Dst: 172.17.0.3
Transmission Control Protocol, Src Port: 53502, Dst Port: 22, Seq: 1546, Ack: 1122, Len: 1208
SSH Protocol

No.     Time           Source                Destination           Protocol Length Info
     15 0.051487020    172.17.0.3            172.17.0.2            SSHv2    1630   Server: Diffie-Hellman Key Exchange Reply, New Keys, Encrypted packet (len=316)

Frame 15: 1630 bytes on wire (13040 bits), 1630 bytes captured (13040 bits) on interface docker0, id 0
Ethernet II, Src: 02:42:ac:11:00:03 (02:42:ac:11:00:03), Dst: 02:42:ac:11:00:02 (02:42:ac:11:00:02)
Internet Protocol Version 4, Src: 172.17.0.3, Dst: 172.17.0.2
Transmission Control Protocol, Src Port: 22, Dst Port: 53502, Seq: 1122, Ack: 2754, Len: 1564
SSH Protocol

No.     Time           Source                Destination           Protocol Length Info
     16 0.051498824    172.17.0.2            172.17.0.3            TCP      66     53502 → 22 [ACK] Seq=2754 Ack=2686 Win=64128 Len=0 TSval=1204576250 TSecr=4256863711

Frame 16: 66 bytes on wire (528 bits), 66 bytes captured (528 bits) on interface docker0, id 0
Ethernet II, Src: 02:42:ac:11:00:02 (02:42:ac:11:00:02), Dst: 02:42:ac:11:00:03 (02:42:ac:11:00:03)
Internet Protocol Version 4, Src: 172.17.0.2, Dst: 172.17.0.3
Transmission Control Protocol, Src Port: 53502, Dst Port: 22, Seq: 2754, Ack: 2686, Len: 0

No.     Time           Source                Destination           Protocol Length Info
     17 1.524304650    172.17.0.2            172.17.0.3            SSHv2    82     Client: New Keys

Frame 17: 82 bytes on wire (656 bits), 82 bytes captured (656 bits) on interface docker0, id 0
Ethernet II, Src: 02:42:ac:11:00:02 (02:42:ac:11:00:02), Dst: 02:42:ac:11:00:03 (02:42:ac:11:00:03)
Internet Protocol Version 4, Src: 172.17.0.2, Dst: 172.17.0.3
Transmission Control Protocol, Src Port: 53502, Dst Port: 22, Seq: 2754, Ack: 2686, Len: 16
SSH Protocol

No.     Time           Source                Destination           Protocol Length Info
     18 1.564530123    172.17.0.3            172.17.0.2            TCP      66     22 → 53502 [ACK] Seq=2686 Ack=2770 Win=64128 Len=0 TSval=4256865225 TSecr=1204577723

Frame 18: 66 bytes on wire (528 bits), 66 bytes captured (528 bits) on interface docker0, id 0
Ethernet II, Src: 02:42:ac:11:00:03 (02:42:ac:11:00:03), Dst: 02:42:ac:11:00:02 (02:42:ac:11:00:02)
Internet Protocol Version 4, Src: 172.17.0.3, Dst: 172.17.0.2
Transmission Control Protocol, Src Port: 22, Dst Port: 53502, Seq: 2686, Ack: 2770, Len: 0

No.     Time           Source                Destination           Protocol Length Info
     19 1.564550866    172.17.0.2            172.17.0.3            SSHv2    110    Client: Encrypted packet (len=44)

Frame 19: 110 bytes on wire (880 bits), 110 bytes captured (880 bits) on interface docker0, id 0
Ethernet II, Src: 02:42:ac:11:00:02 (02:42:ac:11:00:02), Dst: 02:42:ac:11:00:03 (02:42:ac:11:00:03)
Internet Protocol Version 4, Src: 172.17.0.2, Dst: 172.17.0.3
Transmission Control Protocol, Src Port: 53502, Dst Port: 22, Seq: 2770, Ack: 2686, Len: 44
SSH Protocol

No.     Time           Source                Destination           Protocol Length Info
     20 1.564562320    172.17.0.3            172.17.0.2            TCP      66     22 → 53502 [ACK] Seq=2686 Ack=2814 Win=64128 Len=0 TSval=4256865225 TSecr=1204577764

Frame 20: 66 bytes on wire (528 bits), 66 bytes captured (528 bits) on interface docker0, id 0
Ethernet II, Src: 02:42:ac:11:00:03 (02:42:ac:11:00:03), Dst: 02:42:ac:11:00:02 (02:42:ac:11:00:02)
Internet Protocol Version 4, Src: 172.17.0.3, Dst: 172.17.0.2
Transmission Control Protocol, Src Port: 22, Dst Port: 53502, Seq: 2686, Ack: 2814, Len: 0

No.     Time           Source                Destination           Protocol Length Info
     21 1.564624199    172.17.0.3            172.17.0.2            SSHv2    110    Server: Encrypted packet (len=44)

Frame 21: 110 bytes on wire (880 bits), 110 bytes captured (880 bits) on interface docker0, id 0
Ethernet II, Src: 02:42:ac:11:00:03 (02:42:ac:11:00:03), Dst: 02:42:ac:11:00:02 (02:42:ac:11:00:02)
Internet Protocol Version 4, Src: 172.17.0.3, Dst: 172.17.0.2
Transmission Control Protocol, Src Port: 22, Dst Port: 53502, Seq: 2686, Ack: 2814, Len: 44
SSH Protocol

No.     Time           Source                Destination           Protocol Length Info
     22 1.564636142    172.17.0.2            172.17.0.3            TCP      66     53502 → 22 [ACK] Seq=2814 Ack=2730 Win=64128 Len=0 TSval=1204577764 TSecr=4256865225

Frame 22: 66 bytes on wire (528 bits), 66 bytes captured (528 bits) on interface docker0, id 0
Ethernet II, Src: 02:42:ac:11:00:02 (02:42:ac:11:00:02), Dst: 02:42:ac:11:00:03 (02:42:ac:11:00:03)
Internet Protocol Version 4, Src: 172.17.0.2, Dst: 172.17.0.3
Transmission Control Protocol, Src Port: 53502, Dst Port: 22, Seq: 2814, Ack: 2730, Len: 0

No.     Time           Source                Destination           Protocol Length Info
     23 1.564682447    172.17.0.2            172.17.0.3            SSHv2    134    Client: Encrypted packet (len=68)

Frame 23: 134 bytes on wire (1072 bits), 134 bytes captured (1072 bits) on interface docker0, id 0
Ethernet II, Src: 02:42:ac:11:00:02 (02:42:ac:11:00:02), Dst: 02:42:ac:11:00:03 (02:42:ac:11:00:03)
Internet Protocol Version 4, Src: 172.17.0.2, Dst: 172.17.0.3
Transmission Control Protocol, Src Port: 53502, Dst Port: 22, Seq: 2814, Ack: 2730, Len: 68
SSH Protocol

No.     Time           Source                Destination           Protocol Length Info
     24 1.573623381    172.17.0.3            172.17.0.2            SSHv2    118    Server: Encrypted packet (len=52)

Frame 24: 118 bytes on wire (944 bits), 118 bytes captured (944 bits) on interface docker0, id 0
Ethernet II, Src: 02:42:ac:11:00:03 (02:42:ac:11:00:03), Dst: 02:42:ac:11:00:02 (02:42:ac:11:00:02)
Internet Protocol Version 4, Src: 172.17.0.3, Dst: 172.17.0.2
Transmission Control Protocol, Src Port: 22, Dst Port: 53502, Seq: 2730, Ack: 2882, Len: 52
SSH Protocol

No.     Time           Source                Destination           Protocol Length Info
     25 1.614534416    172.17.0.2            172.17.0.3            TCP      66     53502 → 22 [ACK] Seq=2882 Ack=2782 Win=64128 Len=0 TSval=1204577814 TSecr=4256865234

Frame 25: 66 bytes on wire (528 bits), 66 bytes captured (528 bits) on interface docker0, id 0
Ethernet II, Src: 02:42:ac:11:00:02 (02:42:ac:11:00:02), Dst: 02:42:ac:11:00:03 (02:42:ac:11:00:03)
Internet Protocol Version 4, Src: 172.17.0.2, Dst: 172.17.0.3
Transmission Control Protocol, Src Port: 53502, Dst Port: 22, Seq: 2882, Ack: 2782, Len: 0

No.     Time           Source                Destination           Protocol Length Info
     26 4.365292543    172.17.0.2            172.17.0.3            SSHv2    214    Client: Encrypted packet (len=148)

Frame 26: 214 bytes on wire (1712 bits), 214 bytes captured (1712 bits) on interface docker0, id 0
Ethernet II, Src: 02:42:ac:11:00:02 (02:42:ac:11:00:02), Dst: 02:42:ac:11:00:03 (02:42:ac:11:00:03)
Internet Protocol Version 4, Src: 172.17.0.2, Dst: 172.17.0.3
Transmission Control Protocol, Src Port: 53502, Dst Port: 22, Seq: 2882, Ack: 2782, Len: 148
SSH Protocol

No.     Time           Source                Destination           Protocol Length Info
     27 4.400860656    172.17.0.3            172.17.0.2            SSHv2    94     Server: Encrypted packet (len=28)

Frame 27: 94 bytes on wire (752 bits), 94 bytes captured (752 bits) on interface docker0, id 0
Ethernet II, Src: 02:42:ac:11:00:03 (02:42:ac:11:00:03), Dst: 02:42:ac:11:00:02 (02:42:ac:11:00:02)
Internet Protocol Version 4, Src: 172.17.0.3, Dst: 172.17.0.2
Transmission Control Protocol, Src Port: 22, Dst Port: 53502, Seq: 2782, Ack: 3030, Len: 28
SSH Protocol

No.     Time           Source                Destination           Protocol Length Info
     28 4.400879513    172.17.0.2            172.17.0.3            TCP      66     53502 → 22 [ACK] Seq=3030 Ack=2810 Win=64128 Len=0 TSval=1204580600 TSecr=4256868061

Frame 28: 66 bytes on wire (528 bits), 66 bytes captured (528 bits) on interface docker0, id 0
Ethernet II, Src: 02:42:ac:11:00:02 (02:42:ac:11:00:02), Dst: 02:42:ac:11:00:03 (02:42:ac:11:00:03)
Internet Protocol Version 4, Src: 172.17.0.2, Dst: 172.17.0.3
Transmission Control Protocol, Src Port: 53502, Dst Port: 22, Seq: 3030, Ack: 2810, Len: 0

No.     Time           Source                Destination           Protocol Length Info
     29 4.400998313    172.17.0.2            172.17.0.3            SSHv2    178    Client: Encrypted packet (len=112)

Frame 29: 178 bytes on wire (1424 bits), 178 bytes captured (1424 bits) on interface docker0, id 0
Ethernet II, Src: 02:42:ac:11:00:02 (02:42:ac:11:00:02), Dst: 02:42:ac:11:00:03 (02:42:ac:11:00:03)
Internet Protocol Version 4, Src: 172.17.0.2, Dst: 172.17.0.3
Transmission Control Protocol, Src Port: 53502, Dst Port: 22, Seq: 3030, Ack: 2810, Len: 112
SSH Protocol

No.     Time           Source                Destination           Protocol Length Info
     30 4.412004941    172.17.0.3            172.17.0.2            SSHv2    694    Server: Encrypted packet (len=628)

Frame 30: 694 bytes on wire (5552 bits), 694 bytes captured (5552 bits) on interface docker0, id 0
Ethernet II, Src: 02:42:ac:11:00:03 (02:42:ac:11:00:03), Dst: 02:42:ac:11:00:02 (02:42:ac:11:00:02)
Internet Protocol Version 4, Src: 172.17.0.3, Dst: 172.17.0.2
Transmission Control Protocol, Src Port: 22, Dst Port: 53502, Seq: 2810, Ack: 3142, Len: 628
SSH Protocol

No.     Time           Source                Destination           Protocol Length Info
     31 4.412374401    172.17.0.2            172.17.0.3            SSHv2    646    Client: Encrypted packet (len=580)

Frame 31: 646 bytes on wire (5168 bits), 646 bytes captured (5168 bits) on interface docker0, id 0
Ethernet II, Src: 02:42:ac:11:00:02 (02:42:ac:11:00:02), Dst: 02:42:ac:11:00:03 (02:42:ac:11:00:03)
Internet Protocol Version 4, Src: 172.17.0.2, Dst: 172.17.0.3
Transmission Control Protocol, Src Port: 53502, Dst Port: 22, Seq: 3142, Ack: 3438, Len: 580
SSH Protocol

No.     Time           Source                Destination           Protocol Length Info
     32 4.412386763    172.17.0.3            172.17.0.2            SSHv2    110    Server: Encrypted packet (len=44)

Frame 32: 110 bytes on wire (880 bits), 110 bytes captured (880 bits) on interface docker0, id 0
Ethernet II, Src: 02:42:ac:11:00:03 (02:42:ac:11:00:03), Dst: 02:42:ac:11:00:02 (02:42:ac:11:00:02)
Internet Protocol Version 4, Src: 172.17.0.3, Dst: 172.17.0.2
Transmission Control Protocol, Src Port: 22, Dst Port: 53502, Seq: 3438, Ack: 3722, Len: 44
SSH Protocol

No.     Time           Source                Destination           Protocol Length Info
     33 4.412441658    172.17.0.2            172.17.0.3            SSHv2    442    Client: Encrypted packet (len=376)

Frame 33: 442 bytes on wire (3536 bits), 442 bytes captured (3536 bits) on interface docker0, id 0
Ethernet II, Src: 02:42:ac:11:00:02 (02:42:ac:11:00:02), Dst: 02:42:ac:11:00:03 (02:42:ac:11:00:03)
Internet Protocol Version 4, Src: 172.17.0.2, Dst: 172.17.0.3
Transmission Control Protocol, Src Port: 53502, Dst Port: 22, Seq: 3722, Ack: 3482, Len: 376
SSH Protocol

No.     Time           Source                Destination           Protocol Length Info
     34 4.415064126    172.17.0.3            172.17.0.2            SSHv2    606    Server: Encrypted packet (len=540)

Frame 34: 606 bytes on wire (4848 bits), 606 bytes captured (4848 bits) on interface docker0, id 0
Ethernet II, Src: 02:42:ac:11:00:03 (02:42:ac:11:00:03), Dst: 02:42:ac:11:00:02 (02:42:ac:11:00:02)
Internet Protocol Version 4, Src: 172.17.0.3, Dst: 172.17.0.2
Transmission Control Protocol, Src Port: 22, Dst Port: 53502, Seq: 3482, Ack: 4098, Len: 540
SSH Protocol

No.     Time           Source                Destination           Protocol Length Info
     35 4.416115865    172.17.0.3            172.17.0.2            SSHv2    174    Server: Encrypted packet (len=108)

Frame 35: 174 bytes on wire (1392 bits), 174 bytes captured (1392 bits) on interface docker0, id 0
Ethernet II, Src: 02:42:ac:11:00:03 (02:42:ac:11:00:03), Dst: 02:42:ac:11:00:02 (02:42:ac:11:00:02)
Internet Protocol Version 4, Src: 172.17.0.3, Dst: 172.17.0.2
Transmission Control Protocol, Src Port: 22, Dst Port: 53502, Seq: 4022, Ack: 4098, Len: 108
SSH Protocol

No.     Time           Source                Destination           Protocol Length Info
     36 4.416141357    172.17.0.2            172.17.0.3            TCP      66     53502 → 22 [ACK] Seq=4098 Ack=4130 Win=64128 Len=0 TSval=1204580615 TSecr=4256868075

Frame 36: 66 bytes on wire (528 bits), 66 bytes captured (528 bits) on interface docker0, id 0
Ethernet II, Src: 02:42:ac:11:00:02 (02:42:ac:11:00:02), Dst: 02:42:ac:11:00:03 (02:42:ac:11:00:03)
Internet Protocol Version 4, Src: 172.17.0.2, Dst: 172.17.0.3
Transmission Control Protocol, Src Port: 53502, Dst Port: 22, Seq: 4098, Ack: 4130, Len: 0

No.     Time           Source                Destination           Protocol Length Info
     37 4.416290399    172.17.0.3            172.17.0.2            SSHv2    566    Server: Encrypted packet (len=500)

Frame 37: 566 bytes on wire (4528 bits), 566 bytes captured (4528 bits) on interface docker0, id 0
Ethernet II, Src: 02:42:ac:11:00:03 (02:42:ac:11:00:03), Dst: 02:42:ac:11:00:02 (02:42:ac:11:00:02)
Internet Protocol Version 4, Src: 172.17.0.3, Dst: 172.17.0.2
Transmission Control Protocol, Src Port: 22, Dst Port: 53502, Seq: 4130, Ack: 4098, Len: 500
SSH Protocol

No.     Time           Source                Destination           Protocol Length Info
     38 4.416526602    172.17.0.3            172.17.0.2            SSHv2    398    Server: Encrypted packet (len=332)

Frame 38: 398 bytes on wire (3184 bits), 398 bytes captured (3184 bits) on interface docker0, id 0
Ethernet II, Src: 02:42:ac:11:00:03 (02:42:ac:11:00:03), Dst: 02:42:ac:11:00:02 (02:42:ac:11:00:02)
Internet Protocol Version 4, Src: 172.17.0.3, Dst: 172.17.0.2
Transmission Control Protocol, Src Port: 22, Dst Port: 53502, Seq: 4630, Ack: 4098, Len: 332
SSH Protocol

No.     Time           Source                Destination           Protocol Length Info
     39 4.416546856    172.17.0.3            172.17.0.2            SSHv2    126    Server: Encrypted packet (len=60)

Frame 39: 126 bytes on wire (1008 bits), 126 bytes captured (1008 bits) on interface docker0, id 0
Ethernet II, Src: 02:42:ac:11:00:03 (02:42:ac:11:00:03), Dst: 02:42:ac:11:00:02 (02:42:ac:11:00:02)
Internet Protocol Version 4, Src: 172.17.0.3, Dst: 172.17.0.2
Transmission Control Protocol, Src Port: 22, Dst Port: 53502, Seq: 4962, Ack: 4098, Len: 60
SSH Protocol

No.     Time           Source                Destination           Protocol Length Info
     40 4.416552583    172.17.0.2            172.17.0.3            TCP      66     53502 → 22 [ACK] Seq=4098 Ack=4962 Win=64128 Len=0 TSval=1204580616 TSecr=4256868076

Frame 40: 66 bytes on wire (528 bits), 66 bytes captured (528 bits) on interface docker0, id 0
Ethernet II, Src: 02:42:ac:11:00:02 (02:42:ac:11:00:02), Dst: 02:42:ac:11:00:03 (02:42:ac:11:00:03)
Internet Protocol Version 4, Src: 172.17.0.2, Dst: 172.17.0.3
Transmission Control Protocol, Src Port: 53502, Dst Port: 22, Seq: 4098, Ack: 4962, Len: 0

No.     Time           Source                Destination           Protocol Length Info
     41 4.421231247    172.17.0.3            172.17.0.2            SSHv2    158    Server: Encrypted packet (len=92)

Frame 41: 158 bytes on wire (1264 bits), 158 bytes captured (1264 bits) on interface docker0, id 0
Ethernet II, Src: 02:42:ac:11:00:03 (02:42:ac:11:00:03), Dst: 02:42:ac:11:00:02 (02:42:ac:11:00:02)
Internet Protocol Version 4, Src: 172.17.0.3, Dst: 172.17.0.2
Transmission Control Protocol, Src Port: 22, Dst Port: 53502, Seq: 5022, Ack: 4098, Len: 92
SSH Protocol

No.     Time           Source                Destination           Protocol Length Info
     42 4.421259602    172.17.0.2            172.17.0.3            TCP      66     53502 → 22 [ACK] Seq=4098 Ack=5114 Win=64128 Len=0 TSval=1204580620 TSecr=4256868077

Frame 42: 66 bytes on wire (528 bits), 66 bytes captured (528 bits) on interface docker0, id 0
Ethernet II, Src: 02:42:ac:11:00:02 (02:42:ac:11:00:02), Dst: 02:42:ac:11:00:03 (02:42:ac:11:00:03)
Internet Protocol Version 4, Src: 172.17.0.2, Dst: 172.17.0.3
Transmission Control Protocol, Src Port: 53502, Dst Port: 22, Seq: 4098, Ack: 5114, Len: 0
